,name,date,rating,content,like
527,ふうあや,2016年5月26日,1,ドコモで強制的に入会させられて、アカウントも作っていないのに２ヶ月分(980円×２回)も勝手に課金させられてた。弟も同じ状態になっていて、何度か問い合わせをしても『返金できない』の一点張り。電話の窓口もないし、色々と信憑性がなさ過ぎる。最悪なアプリです、みなさん気をつけてください。,16
528,はる,2016年5月29日,3,韓国の歌が聞きたいのにこの国での再生は対応していませんってショックです。それがなければ結構いいかな,71
529,Ster Buu,2016年6月4日,3,他の物よりは全然いい！登録もいらないし、 いろんな曲が入ってて最高！でも1ヵ月までは無料だけどその後有料なのが残念😞,1
530,市原さち,2016年6月15日,1,聴いた曲が勝手にキャッシュされる。キャッシュされるのに次見るとキャッシュが消えてる。キャッシュしたい曲も消えてるから意味ない。歌詞の漢字が間違えてたりはあり得ない！,34
531,大西勇也,2016年6月10日,4,もう少しアーティストの数を増やせないんですか？例えばbacknumberとか家入レオなどを入れてもらえるならまだ使い続けます！,6
532,もっちmomo-,2016年6月14日,4,様々な定額制ミュージックアプリ試してみましたが、このアプリが一番良いです！ですが...有名なアーティストなのに曲がないときがあってショック。。。back number聴きたいです！,32
533,三星太郎,2016年6月2日,3,１ヶ月楽しく使用しました。ありがとうございました。アジア最大なのに、他国曲はダメって•••。★-1 でもって、終了後の勧誘メール多い。★-1 計-2,8
534,tomy hew,2016年6月6日,1,auの時は使いやすく正常だった、今の問題点、起動する度再起動、キャッシュしても次に開くとキャッシュが０曲、全体的に重い、シェアとかいらない、オルゴール系いらない、アニソンいらない、jpop少ないのはしゃーない、洋楽が売りだったのに意味が分からない、今のところ有料は詐欺レベル、今までありがとーさよーなら,42
535,かゆ,2016年6月10日,3,好きな曲がけっこうあって気に入ったから有料にしたけど、最近再生中に突然音楽が切れることがことが多い。改善してほしい。,21
536,しろちゃん,2016年5月26日,5,最初の1ヶ月は聞き放題で速度制限にかかってもスムーズに聞けて凄い良かったです!!でも1ヶ月っていうのがちょっと残念かな…それと､このアプリだけで1GBも容量を使わなくちゃいけないのがとても残念です…この2点が無かったら使い続けてたかも知れません｡,26
537,伊藤琴音,2016年6月17日,1,前入れたことあって1ヶ月トライアルでも30秒しか聞けないとな史上最低アプリですね,1
538,齋藤魅,2016年5月26日,2,最初は普通に聴けていたんですが、久しぶりに開いて聴いてみると30秒しか聴けませんでした。おかしいと思います。,18
539,柳澤秀幸,2016年6月6日,2,以前はランダム再生が行えていたのに、以降してからはできなくなった,6
540,小野隆雄,2016年5月28日,3,最初の１ヶ月は普通に聴けたが最近は３０秒しか聴けないのはショックです,27
541,ばびらぶ,2016年6月14日,2,曲がきちんと最後まで聞けない。直らないならアンスト,1
542,ぬな,2016年6月19日,4,最高なんだけど……一ヶ月しか使えないのはちょっとなぁ~、金使わなくていいんだったら皆使うのになぁ~,1
543,剃り残しブルース,2016年6月1日,1,１ヶ月は短すぎ！アンストしまーす！ありがとでした（嫌み）,4
544,松原匠吾,2016年6月3日,3,曲がいきなり30秒しかきけなくなったー,2
545,たけのうちなぎこ,2016年6月21日,4,いいと思います！！もっとK-POPなど最近の曲も増えていくといいなと思います…,2
546,AKナイトホーク,2016年5月28日,1,無料トライアルやるなとは言わないからせめて1年ぐらいに伸ばしてほしいです(´д｀|||),2
547,さこあみり,2016年6月15日,4,あぷりはさいこうだけど、いっかげつだけってゆうのはなー。ずっとむりょうだったらほしごかな。。。,1
548,鷲見明菜,2016年6月23日,4,K-POPの曲をもっと増やしてください！,1
549,Al Wi,2016年6月3日,3,こんなにいいアプリはトライアル期間とかなくして、普通のアプリにしてほしい！,1
550,Surasu boy,2016年6月1日,1,なぜ30秒だけにしたし,2
551,佐藤裕,2016年6月20日,4,取り込み易い、分け易い。,1
552,奥村将太,2016年5月29日,5,ちゃんと読んでから使えよ,5
553,山下和騎,2016年6月27日,4,back numberいれてくれ音質いいからおねがいします！,0
554,井村眞治,2016年6月23日,5,昔懐かしい歌が一杯聞けて最高です。,1
555,橋田悠樹,2016年10月5日,1,聞きたい曲が全部オルゴールとか　まじさいやく,0
556,キムラミホ,2016年8月6日,2,アニソンが全然ない,0
557,荻野和弘,2016年6月5日,4,なかなか良い❗,2
558,よぐらみなみ,2016年6月24日,5,機内モードでも聴けるから幸せ！,1
559,高橋美麗,2016年6月16日,3,かなりいいね,1
560,峠の漁り火,2016年5月29日,5,とても使いやすいです。,1
561,howaito man,2016年5月27日,5,いいよw,3
562,anpan man,2016年6月19日,5,すごくいい！,0
563,市村春子,2016年6月3日,5,有料だけの価値あり(*^ー^)ノ♪,1
564,屋台のおやじ,2016年6月7日,4,いいね,0
565,りょうかとう,2016年5月27日,5,さいこう,1
566,Machapi i,2016年5月26日,5,聴き放題だし、速度制限かかりにくいし。ただ、アプリに曲をキャッシュして保存しておく方法なので、キャッシュクリアアプリの使い方に注意しようね。,1
567,らら,2016年5月23日,4,このアプリで音楽聞きながらLINEとかTwitterとかしてたらすぐ音楽が終了してしまう！なんで！改善してほしいです！,11
568,のれんねこ【Alone Our】,2016年5月17日,2,だけど無料期間が1ヵ月のはずが3日で終わった なぜに,45
569,小林弘樹,2016年5月18日,5,すごくいいと思います。けど無料期間をずっとだったら良いです。お金はかけたくないです！m(__)m,70
570,shiz ko,2016年5月22日,3,BUMP OF CHICKENの曲が聴けるという広告を見てダウンロードしたけど、BUMPだけオフライン再生もバックグラウンド再生もできんし、YouTubeの公式MVだけだし課金してまで続けないかな,1
571,優霧凜音,2016年5月27日,2,韓国の歌がききたいのにこの国では対応してませんとかでて、最悪,1
572,零羅,2016年5月20日,1,期間30日は短すぎです！期間を長くしてください！,4
573,kuroro96,2016年5月20日,1,俺が聞きたい曲が一切ない！ふざけんな,3
574,M 368,2016年5月18日,1,オルゴールばっかりなのは何かの嫌がらせですか？,15
575,ねむnemu,2016年5月19日,1,1ヶ月のはずが1日で終わりました,3
576,まなみ,2016年5月27日,1,すぐに強制終了になります。それ以外はとてもいいのでそこを直してほしいです。,0
577,みかんみかん,2018年1月4日,5,音質がいい 課金しても損はしないかな 好きな曲をオフラインで好きな時に聴けるからいい もう少し新曲を増やしてほしい。,0
578,TA KO,2016年5月18日,4,Googleで支払えるようにして,9
579,ろうふく,2016年5月18日,3,ランダム機能がないなぜ？改善して,2
580,鈴木翔,2016年5月25日,3,ずっと無料だったら文句無いです,1
581,山岸拓也,2016年5月22日,4,一ヶ月が、短い,2
582,前田直樹,2016年5月21日,5,使いやすくてすごくいいと思う,0
583,129 426,2016年5月19日,2,曲増やせ,3
584,Takehiro Ogura,2016年5月20日,5,歌詞が出るのがいいね,2
585,金城正,2016年5月17日,3,まあまあ,10
586,べべべベイルべべべベイル,2016年5月22日,4,まぁまぁ,1
587,芳の内しようじ,2016年5月21日,5,なごり雪,2
588,啓石,2016年5月11日,3,ライブラリのアーティスト順、アルバム順のスクロールバーでのリスト移動が出来なくなった。またアーティスト、アルバムを表示後、リストに戻ると元の表示ではなくリスト先頭から表示される為、不便。20000曲の制限下で1000アーティスト、1000アルバムを想定して試験してリリースして下さい。,57
589,Mike key,2016年5月14日,4,できれば一か月と言わずずっと無料にして欲しかった。 検索しても出てこない曲もあったので追加もして欲しい。,4
590,小笠原みずき,2016年5月15日,4,今まで表示されていたのにアルバムやシングルのジャケットが表示されなくなりました。音楽は問題なく聴けます。改善お願いします。,25
591,ポメラニアン,2016年5月14日,3,B'z'、backnumber、マキシムザホルモン、凛として時雨その他もろもろ。1000円も課金させるぐらいだったらもうちょい曲増やそ…,15
592,アニ音配信者Z,2016年5月13日,1,キャッシュタップしてもダウンロードなんねーし音楽再生ボタン押しても音楽聴けないふざけんな,9
593,ああああ,2016年5月12日,2,キャッシュした曲にも関わらす途中で止まります。,23
594,夢々,2016年5月15日,3,ボカロの曲があんまり無い！！         リクエストしたのに！！   でもアプリ自体はいいので星3ぐらいですかね？,5
595,松橋里絵,2016年5月20日,4,無料トライアルなのに30秒しか聞けない,0
596,茂佐藤,2016年5月15日,1,したのに聞けない,1
597,高高,2016年5月17日,5,好きな曲めっちゃあった！こうゆうの探してた！,2
598,町田大季,2016年5月15日,5,月額かかるけどそれに見合う！,2
599,鈴木唯日,2016年6月2日,4,いい感じ曲もたくさんあるし、でも重い,0
600,うちはイタチ,2016年5月13日,4,まぁまぁいいかな,1
601,Googleユーザー,2018年2月15日,5,サイコー,0
602,鈴木衣織,2016年4月30日,5,機械音痴な自分が行けないのかも知れませんが、使い方が分からず。。wでも、やっとわかってきたので愛用してます♡広告に載っててほとんどの人が星5だったので半信半疑で使ってみたんですけど、すごく使いやすいです！！こーゆーのを探してました！(〃'▽'〃),61
603,I Hitomi,2016年5月2日,5,こんなアプリ探してました！懐かしい曲もカラオケみたくサクッと検索出来るし音も綺麗だし文句なしです。一ヶ月無料は残念すぎます。,85
604,036 09,2016年4月21日,2,１度アンストしたけど、改善されてるのか試しにもう一度インストールしてレビュー書きます。たしかに曲数と音質は文句なしなので、聞きたいときに聞きたいのだから、アプリの使い方や機能の説明ならメニューに入れればいいと思う。プッシュ通知であれしろこれしろは、いらない。そこは、必要ないものなので検討をw,20
605,青山勇太,2016年5月2日,4,いいけどさ、１ヶ月無料っていうのは嘘だね。俺なんか、3日で終わっちまったよ。多分、日にちじゃなくて再生時間で終わりにされちゃうんだね。しっかり１ヶ月にしてほしいです。,7
606,時無泝,2016年5月9日,4,曲聞いてて歌詞を見ようとして歌詞見たら少し前までは普通ですが歌詞のみ見れました。今は表示されていた部分が半分を堺に上にその変な絵が出ていて下に歌詞が表示されている感じです。絵があるせいで字が小さくなってます。どうにかしてその変な絵を削除出来ませんか、？それ以外はいいアプリだと思います。,0
607,Natsumi Takeuchi,2016年5月5日,3,一ヶ月無料で聴けるということだったので、このアプリをダウンロードして早速音楽を聴こうと曲を押したのに短い時間しか聴けなくて最後まで聴けません(;Д;)(;Д;)たくさんの曲があってとても良いのですがこのアプリは一ヶ月無料の時から最後まで曲を聴くことができないのですか？一ヶ月無料が終わったら30秒しか聴けなくなるのは了承していたのですが最初から短い時間しか聴けないのは変だなーって思いました｡ちゃんと聴けるようにするにはやっぱり会員登録しなくてはならないんですか？どうすればいいのですか？教えてくださいm(_ _)m,17
608,坂本美蓮,2016年4月28日,1,１ヶ月も使ってないのに、もう聴けへんくなった。速攻改善願います。,5
609,松田楓,2016年5月4日,3,１ヶ月無料で使えていて良かったのに、プレミアム会員になろうとして決済？しましたとか出てくるのにいざ開くとネットワークがどうのって30秒しか聴けなかった…もうなおった見たいだけど…それがなかったら★★★★★なのにっ,0
610,晃人中村,2016年4月29日,5,てのもある程度使っていけば解ると思いますが自分好みの音楽が見つけやすいのと新しい発見があるから！！　関連曲とか８０年や90年代の流行った曲なんかもなかなか探しても出てこない曲まであるのが凄い,7
611,真博柴田,2016年5月8日,4,このアプリむちゃくちゃ気に入りました！歌詞出てくるし、気軽に聞けるし、、良すぎるでしょー！でも私は学生なので月額９６０円は大きな出費、、５００円位のプランがあったら即会員登録するのに…     残念すぎます(இДஇ  ),1
612,show channel,2016年5月4日,2,三十秒ぐらいしたら音楽が勝手に止まる、なんで？プレミアム会員登録しろと？ まーとまるんがなかったら間違いなく星5,94
613,吉田友衣,2016年5月6日,2,なんて最後まで曲が流れないのですか...最後にブチっといって曲が途中で終わります。とても迷惑です。それさえなければいいのですが...改善よろしくお願いします,3
614,S. S,2016年4月23日,3,すっごい良かったからまた使いたい！！でも私は今無料を求めているので却下。,14
615,高橋靖郎,2016年4月28日,5,今迄は、音楽聴いてる時別の所を見たりすると一回切れたりしたけど、これは音楽聴きながら別の所見ても切れたりしないので、凄くいいと思います。,35
616,ponnu kido,2016年4月27日,4,無料期間が終わってしまって、また聴くためには、プレミアム会員にならないと聴けないの？無料の会員登録的なやつないでしょうか(^^;),6
617,yumayo,2016年5月1日,1,なんで途中からになんだよふざけんな！おかしい                                                       スマホがおかしいって言うのかよ       早く直して            だりぃーーーーー   このアプリ○○！これはひどい,2
618,園田祐也,2016年6月3日,1,プレミアム会員登録してキャッシュしても聞けないし金払ってんのにいつになったら聴けるのか、意味がわからんし問い合わせの窓口ぐらいつくれよ。最悪ですねこのアプリ。,0
619,午後の紅茶,2016年4月19日,5,かなり使いやすい自分はAWAを使っていたんですけど検索かけたときに同じような音楽がでてくるので非常に使いやすい,209
620,そのだかずき,2016年4月22日,4,機能は完璧だが、曲が少なすぎるし、アーティストを検索しても出ない場合が、多い,12
621,Rinna Kono,2016年5月21日,3,すごく気に入って使ってました。だけど、無料期間がすぎると30秒しか聞けなくなって… お金かけたくないのでずっも無料期間だったらいいな,0
622,Yi Hao Chai,2016年4月23日,4,4 stars due to the lack of Japanese songs selection. Also due to lack in some chinese songs for example china singers. Some songs can't be play due to where i subscrube from. Otherwise it is good.,40
623,堀山ユミ,2016年4月28日,5,今までのアプリお金かかったけど、このアプリマヂで( ・∀・) ｲｲﾈ！新曲いっぱいあって飽きない,9
624,Jones water,2016年5月5日,5,待ってたぜ‼こういうアプリを探してたの！検索も出来て、オフラインでも聞けるから便利ですね。,5
625,ysn f,2016年5月2日,3,好きな曲あるしバックグラウンドでも聴けていいけどデータ通信量めっちゃ食うから3,6
626,りょう及川,2016年4月22日,5,使いやすいし、機能に関する不満は特にありませんが、個人的にはmiwa の曲をもっと増やして欲しいです。,23
627,うえばらさららん,2016年5月7日,5,ヤバイ！ただ単に楽しー！,0
628,翡翠,2016年5月4日,4,無料だったら星４つ！無料だったら文句無し！一番好き。歌詞が見やすい音質もいいのにもったいない(≧ω≦),0
629,腐ったおもち。,2016年4月23日,5,最高！！ホームに戻っても音楽なるから本当便利。こーゆうアプリをずっと探してた！,182
630,Owl 810,2016年4月30日,5,マジで、めっちゃいい！マニアックな音楽でも結構ヒットしていいです！これから、もっといいアプリになることを期待します。,3
631,Tー YUK,2016年4月25日,5,学生時代に聴いていた懐かしいアルバムに久しぶりに出逢えました。感謝!!,49
632,中上祥子,2016年5月26日,4,自動で課金に移るのがなければ星5。あと、もっと曲を増やしてほしいです。,0
633,Satoh Toshihiro,2016年5月4日,4,洋楽好きには、良い方のアプリ❢　もう少しアルバムの種類とアーティストを増やしたら星５つ(^^),3
634,果物美味しい,2016年4月28日,4,聞きやすくて良いのですが、プレイリストにランダム機能があると良いです。ってかあるのかな？,3
635,柚希もも,2016年6月2日,2,再生時間が三分から３０秒になるのはなぜですか?今まではとても使いやすくて好きだったのですが、、、がっかりです,0
636,SARU 3,2016年5月4日,5,ですがやっぱり今時の音楽アプリはお金をとるんですね。まあでも結構使いがってがいいのでよかったです。,3
637,浦川紅葉,2016年6月25日,3,１ヶ月しか、持たないから、おすすめは、しなーい👹しかも、あインストールしても、戻らない💢💢💢💢💢,58
638,ろくでなしい,2016年5月8日,4,完璧なんですが、back numberがないのはがっかりでした。,2
639,里奈川島,2016年5月5日,4,まあまあですね 歌詞出ないのもあるから星4つにしました,0
640,前田萌絵,2016年4月22日,4,無料で、ずっとやって欲しかった,9
641,おもしろいhayato,2016年5月1日,1,歌がと中からしか聞こえない,4
642,いつでもみかん,2016年4月30日,1,一ヶ月使ってないのに30秒再生になってるのを改善してください。,2
643,マイプラ,2016年5月3日,1,なんか30秒しかきけなくなったふざけんなちゃんと聞けたら☆☆☆☆☆なんだけど,11
644,森風音,2016年5月2日,5,めっちゃ使いやすい！画面消しても聞けるから、めっちゃいい！それに、音も聞き取りやすくてすごく使えます！これが、無料でいいんですか？！,0
645,いとうみさき,2016年4月29日,1,キスマイの曲がオルゴールしかない。もっと出してほしい,2
646,若井あきこ,2016年5月7日,1,30秒で音楽が止まるの、最悪なんですけど。だから☆1つです。,0
647,鈴木香弥,2016年4月29日,4,Wi-Fi使わないで聞けるとこがいい,2
648,キミライコネン,2016年4月27日,3,プレミア会員って月額いくらなんでしょう❔,4
649,川村寿彦,2016年4月27日,5,良いんだけどユニゾンが無いのは残念だな,1
650,藤本一希,2016年4月25日,1,30秒しかきけない,0
651,渡邊稜わたなべりょう,2016年4月20日,5,メッチャメチャイイアプリだとおもいます,13
652,_03 sHuRe,2016年5月30日,4,セカオワとか星野源などの流行りの曲があると☆5確定かな,1
653,津川勝治,2016年4月25日,5,音もよく、いいと思います❗,10
654,藤井志保,2016年5月7日,3,サビから30秒しか再生されないんですけど,1
655,ゆうたろう,2016年4月24日,3,曲数をもっと増やしてほしい。,0
656,隼人中澤,2016年4月22日,1,有料会員登録したのに30秒再生になる。,2
657,Ww enigma wW,2016年4月28日,3,イコライザーの調整を自分で出来るようにして欲しい！,1
658,天魔朱雀,2016年5月4日,5,いいですね～(*´ω｀*)こういう感じのアプリがもっと増えればいいのになぁ無料で(´-ω-`)ずっと無料でお願いしたいです(^人^),2
659,木下クルミ,2016年5月9日,1,プレミアム会員登録しなくてもフル聴けるようになれば星5つです｡,0
660,長井俊,2016年4月21日,5,とっても使いやすくていいですサイコー,5
661,縄手輝,2016年4月30日,5,鋤醐琥晷々彌鋤偉,0
662,飯田愛,2016年5月3日,1,いい曲全くない,1
663,藤井彩良,2016年5月14日,5,少し月額が高いけど最高！！！,0
664,れいな高山,2016年5月2日,5,ほんとに最高！幅の広い音楽が聴けるし種類も豊富！ほんとにこのアプリはオススメ👍💕,1
665,利恵來住,2016年5月5日,4,サブリナ・カーペンターは Sabrina Carpenterと打つとでました(*´∀`*)ノ,0
666,道枝りゆ。,2016年4月23日,1,アニメの歌がない！,3
667,Keiichi Nakazawa,2016年5月5日,2,聴きたい曲が全く見つかりません,0
668,軽部博美,2016年5月1日,5,Androidばんのミュージックボックス！！本当最高級だわ,2
669,山本明子,2016年4月28日,2,データー使いすぎ。,1
670,isapen Shogaku,2016年5月7日,3,追加できない曲がけっこーある,0
671,BTS大好き,2016年5月3日,3,無料で、聞けるのが１ヶ月だなんて、短すぎます,0
672,world麻留子,2016年4月30日,4,ダウンロードに、時間がかかる。,0
673,REヒル,2016年4月24日,1,使えない。,1
674,岡田世界,2016年4月26日,1,曲数少なすぎ,1
675,日高屋のチゲ味噌ラーメン,2016年5月7日,1,スマホじゃないと支払えないんですね,0
676,晃子石田,2016年5月3日,1,金使うじゃん。私だけ？,0
677,なれ,2016年4月27日,5,音楽無料で聞き放題!!,1
678,ジャポニカ,2016年5月8日,5,最高すぎるという感じ,0
679,なゆうくん,2016年5月6日,5,おもろい,0
680,ストームトルーパー,2016年5月6日,5,欲しい曲がたくさんｱﾙ(＞∀＜)‼︎,0
681,瑠偉たくま,2016年5月7日,5,めっちゃいい,0
682,小圷芳光,2016年4月23日,5,よい,1
683,鈴木章斗,2016年4月25日,5,やばい,1
684,Axis_ Emanon,2016年5月1日,5,最高,0
685,Googleユーザー,2016年11月28日,4,台湾の歌ばかり聞くせいか、国の設定が台湾になっています！ 日本にしたいです。どうやればできますか？ ヘルプも、台湾語になっています！少しはわかるけど、基本的には、わからないので、日本に設定したい！,0
686,Googleユーザー,2016年11月23日,1,というより新規登録出来ない！評価云々以前の問題。,0
687,平山有人,2017年6月18日,2,課金制度が無かったら物凄く良いアプリなんですが…,0
688,Googleユーザー,2017年3月27日,2,ログインできません　（facebookで）,0
689,のりゆき菅原,2016年4月13日,5,凄い使いやすい。曲も凄い増えてきたし、タイアップのような企画があって楽しいと思います。もっと日本のアーティストを増やせればもっと利用者が増えるとおもうけど、現状でも、洋楽が特に豊富だと感じるのでかなり満足してます。,4
690,ひろたひろし,2016年4月9日,4,Google Play musicよりインターフェイスがしっかりしている分使いやすい。音楽ダウンロードも早く、データ使用量も少なく感じる。一度聴いた曲をキャッシュしてくれるので、電波を気にせず使えるのがいい。オリジナルの曲を聴きたいのに、変なカバー曲や、オルゴールとかが出るところがいただけない。未収録の音楽をカバー曲で何とかするのではなく、やはりオリジナルの声で聞きたい。LINEミュージックよりバリエーションがあるが、AWAはエイベックスな分、比べてみたいきもする。,97
