,name,date,rating,content,like
2426,森下れいこ,2019年1月1日,5,聴きやすくていいです,0
2427,pum pk!n,2018年10月17日,5,んーとりあえずレビューしてみました😕,2
2428,Googleユーザー,2018年10月12日,5,いいと思います。まださっきダウンロードしたばかりだからよくわかりません。,3
2429,さかた!らいお!,2019年5月27日,3,閉じて聞けるからいいと思った,0
2430,Googleユーザー,2019年5月6日,2,このアプリラグが多すぎる,0
2431,ずんずん,2019年6月27日,5,いつも使わせてもらってます,0
2432,えみきた,2018年11月17日,5,気に入って使ってます！,1
2433,Googleユーザー,2019年1月6日,5,新しい音楽をいっぱい聴けそうで嬉しい😄,1
2434,Googleユーザー,2019年2月8日,5,凄く便利です!,1
2435,浅野由美子,2018年10月20日,4,使い方は分かりやすかったです。,2
2436,Googleユーザー,2018年12月5日,5,もうちょっと他のアプリを開いていても使えるようにして欲しい,1
2437,KingGnu神俺はズラタン,2019年11月27日,5,とてもいい ですがうつってしまうのは残念,0
2438,Shouchan Takaba No,2018年12月1日,4,レビュー書かくの強制してくんのあんまし好きじゃないなぁ( 'ω'),0
2439,Googleユーザー,2019年1月23日,5,無料で音楽が聞けていい‼️,0
2440,ヴィンセン子,2019年2月17日,3,評価しろってしつこいです,0
2441,Googleユーザー,2019年1月12日,3,まだ、慣れていないので使いこなすぞー,0
2442,アリアライト,2019年2月18日,5,好きな曲が聞ける！,0
2443,Googleユーザー,2019年3月12日,3,音はなかなか良いですよ😃,2
2444,かふー,2018年10月8日,4,とりあえずダウンロードしたばかり。,1
2445,手島大地,2019年2月3日,5,便利 使いやすい,0
2446,スリープLEON,2020年1月13日,1,起動出来ん,0
2447,Googleユーザー,2019年1月27日,5,いろんな曲があっていい,0
2448,Googleユーザー,2019年2月8日,5,凄く使い勝手がいいです,1
2449,Googleユーザー,2019年3月4日,5,とても便利で良いと思います！！(๑•̀ㅂ•́)b✧,0
2450,田代拓海,2019年12月21日,5,とても素敵‼️,0
2451,んず,2019年11月26日,5,アプリを閉じて使えるのがいいと思いました…,0
2452,キャスバル・レム・ダイクン,2020年1月9日,5,なんでもでける,0
2453,めろんぱん,2019年1月3日,5,すげです。まじで使いやすいです。これからも宜しくm(__)m,1
2454,れんながせ,2019年3月12日,4,キンプリが好きなので沢山あって嬉しいです！ ありがとうございます！(´∀`*)ヶﾗヶﾗ,0
2455,Googleユーザー,2019年1月6日,5,とっても使いやすいです,1
2456,Googleユーザー,2019年1月20日,5,とっても使いやすいです,0
2457,Googleユーザー,2018年11月27日,3,ペルソナの音楽がいつでも聞けて良いと思いました,1
2458,31 40,2019年7月20日,5,使いやすいです！ありがとう！,0
2459,林田雅子,2018年11月1日,5,最高です めちゃめちゃ聞きました。,2
2460,Googleユーザー,2018年9月27日,5,いろんな曲があっていいですね,3
2461,Googleユーザー,2018年9月24日,4,直ぐに調べれないです！後、レビューめちゃくちゃうざいです！,7
2462,K3 Jonathan,2019年1月4日,5,とても気に入っています!!,0
2463,Googleユーザー,2019年1月12日,1,YouTubeを引っ張ってるだけなんですね,0
2464,sty,2018年10月8日,5,操作が簡単!!レビューはと評価5はほぼ強制的だね,1
2465,Googleユーザー,2018年10月12日,5,検索しやすい。インストールしたばかりですが今のところ満足です。,1
2466,あららあ,2019年6月17日,5,好きな曲😍発見😘💓💓💓,0
2467,Googleユーザー,2018年11月4日,5,曲がないのがある,2
2468,えりえり,2019年3月16日,5,閉じて再生できるのいいですね,2
2469,Googleユーザー,2019年1月10日,4,プレビューしないともっと見るがならないのでマイナス１,1
2470,嶋田浩子,2018年11月1日,3,アクセス出来ない,2
2471,Googleユーザー,2018年12月17日,2,強制的にレビュー書かせるのはどうかと思う,1
2472,ゲームやりたい,2018年9月23日,5,とても使いやすくていい感じ,3
2473,gsx 400fs,2019年1月22日,5,とても使いやすい。,1
2474,Googleユーザー,2018年12月1日,5,利用するのにとっても良いです,1
2475,Kaoru itokawa,2019年6月11日,1,意味が解らないのと、操作出来ません。操作が解らないですのでaisuto致します❣️,0
2476,Googleユーザー,2018年9月23日,5,とても使いやすいですね。,0
2477,Googleユーザー,2019年3月22日,4,好き曲がすぐに聞けてよかった,1
2478,Googleユーザー,2018年11月20日,5,無料は最高,0
2479,トモヒロハナサキ,2018年12月8日,3,どうかも見れていいですね！,1
2480,管原寛文,2019年6月16日,5,大変、楽しいアプリです❗,0
2481,Googleユーザー,2019年1月20日,5,好きな曲が、あっていい,1
2482,Googleユーザー,2018年10月31日,5,ぜひとも、このアプリを使ってください❗ このアプリは便利です❗,1
2483,Googleユーザー,2019年1月6日,5,リピート機能があっていい,0
2484,仲川美穂,2018年12月21日,5,とってもいいアプリだと思います,1
2485,Googleユーザー,2019年1月27日,5,けっこういいですよ まだ日が浅いですけれどね,1
2486,Googleユーザー,2018年10月18日,5,いい曲たくさん,1
2487,青木れいか,2018年10月20日,5,めっちゃ使いやすいんだが…,2
2488,しょう,2019年2月5日,5,聴きたい曲が聞ける,0
2489,ちばけんと千葉健人,2019年1月20日,1,GBは、かからないんですか？なんかYouTubeの動画が見れるんですけど、初めて使うので教えてください,1
2490,Googleユーザー,2018年12月17日,5,楽しませてもらってます,1
2491,miyuki tanaka,2018年12月26日,5,とりあえず使いやすい,0
2492,カフェオレ,2019年8月31日,3,時々、消えてなくなる,0
2493,佐藤由紀子,2019年7月24日,5,とても良いアプリです🎵,0
2494,武内篤也,2018年10月11日,5,便利なアプリですね。,1
2495,白狗,2019年1月20日,5,レビュー迫られたんだが(困惑),1
2496,Googleユーザー,2018年11月5日,4,名前(グループ名)を検索したらその人たちの動画がすべて出てくると星５になる,5
2497,MH /koala,2019年11月10日,5,普通に使えいいい,0
2498,Googleユーザー,2018年12月22日,5,ずっと聞いていられるのでいいです♥ ぜひインストールしてみて下さい♪ オススメです♪,1
2499,Googleユーザー,2019年4月21日,2,再生途中で落ちる,0
2500,Googleユーザー,2018年12月19日,3,携帯を消しても音楽がなってて欲しい。 ダウンロードってこれあるのかな？,1
2501,ゴーーRI,2019年2月19日,5,いい曲があって嬉しい,0
2502,あんこよもぎ,2019年8月31日,5,最高のアプリです。,0
2503,スタントダクト,2019年11月24日,5,子供が喜んでくれた,0
2504,Googleユーザー,2018年9月24日,5,こーゆー音楽アプリを待っていました!!,4
2505,Googleユーザー,2019年1月29日,5,最高です。気に入りました！！,1
2506,Googleユーザー,2019年1月31日,5,普通に使いやすい,0
2507,武富康,2018年9月19日,5,普通に使いやすい,0
2508,欣孝臼杵,2018年9月15日,5,最高。使いやすい。,0
2509,Googleユーザー,2018年11月6日,3,初めて入れたものだから、良し悪しはわからないです。 検索できるのかな。,2
2510,t-Ace大好き人間,2019年6月29日,5,普通に使いやすい,0
2511,菜っ葉侍,2019年10月22日,3,スマホ閉じても音楽聴けるようにして欲しい,0
2512,日ハムファン,2019年2月24日,5,いつでも使えるのがいい,0
2513,岸邦夫,2019年5月12日,5,面白いです 一度やって見たかった,0
2514,さか悟,2019年4月19日,4,電源切るきけない,0
2515,Googleユーザー,2018年10月23日,2,レビュー求められてインチキ臭いけど、とりあえず様子見で使ってみます。,1
2516,Googleユーザー,2018年11月21日,5,普通にいいアプリ,1
2517,Emi Horiuchi,2018年10月8日,4,いい曲が見つかる,0
2518,あやちゃんチャンネル,2019年11月13日,5,いろんな曲が聞けて嬉しい（　´∀｀）,0
2519,Googleユーザー,2019年3月14日,5,とても良いアプリです,0
2520,ratte0212,2018年11月17日,5,これって検索結果見たかったら☆5しろってことなんだろうか？？,2
2521,A m,2019年1月29日,5,音楽聞けてうれしー。,0
2522,Googleユーザー,2018年10月24日,4,使い始めたばかりです。まだよくわかりません。,2
2523,源田ファン,2018年12月6日,4,これってWi-Fiなくても聞けるやつですか？誰か教えてください！,0
2524,濵田琴音,2019年10月6日,5,普通にいいアプリ,0
2525,LOL Eros-,2019年1月3日,3,オフラインで聞けたら星5だった,1
2526,チャンネルTAKE-C,2019年1月27日,4,まだ、インストールしたばかりなので後ほど評価したいと思います。,1
2527,Googleユーザー,2018年10月20日,5,最高です!!!このアプリ作った人天才,1
2528,Terattikunてらっちくん,2018年11月17日,5,とても便利です,0
2529,寺田愛凜,2018年12月24日,5,私は、音楽がとても好きなのでしました‼️ いろんな曲があって楽しいです❗️,0
2530,Googleユーザー,2018年11月29日,5,最高に使いやすいです。,1
2531,保田宣広,2019年11月25日,5,コンサートの DVD とかを見たい時はどうしますか,0
2532,雪田沙綾香,2018年12月9日,5,はじめてつかうので、よろしく、おねがいします。,0
2533,Googleユーザー,2019年3月26日,5,とても便利です❗,0
2534,サックボーダン,2018年11月7日,5,めっちゃいい、この調子で頑張ってください,2
2535,ぺすくるみ,2018年10月4日,5,星5評価してくださいとインストールしたばかりなのに出てきたので…,5
2536,山﨑直也,2019年11月9日,5,最高のアプリだね!,0
2537,芹澤茂則,2019年11月29日,4,昔聞いていた曲を思い出しながら聞いています。,0
2538,石上未咲,2018年12月5日,3,まだ、一曲も聞いてない状態でルビュー求められても……何を書けと？,1
2539,Masahiro chigasaki,2019年1月26日,3,まだ使い切っていないから分からない。レビューを強制って?,1
2540,EmmaChannel kpoplσνє,2018年11月5日,5,これってオフラインでもできますか？w結構使いやすいです❤,2
2541,Googleユーザー,2018年12月2日,5,使いやすく気に入ってます,1
2542,Googleユーザー,2018年9月16日,5,思ってたより全然良くて最高！,0
2543,國吉優子,2019年8月30日,3,レビューしろとしつこいので書きました。まだよく解らない。,0
2544,Googleユーザー,2018年12月5日,4,まだ使い始めなので わかりませんが良さそうです,1
2545,Googleユーザー,2018年10月1日,3,あのー……これYouTube見たほうがいいですよね？,1
2546,Googleユーザー,2019年2月18日,5,まだ使い始めたばっかだから分かんないけどとりあえずはいー感じかな？,0
2547,わらしざしき,2018年12月30日,5,最高の音楽アプリ,1
2548,高月賢二,2019年2月9日,4,歌詞があったら最高,1
2549,Googleユーザー,2018年12月30日,4,pvが見れるから良い!,0
2550,恵美高田,2019年2月17日,4,まだわかりません。私に合っているのか？ いろんなレビューを見て決めた所です。,0
2551,Googleユーザー,2018年12月17日,5,使い方が分かりやすくていい,1
2552,ゆっくりイズナ,2018年11月25日,5,星５もらわないとやっていけないんですねかっわいそー,2
2553,Googleユーザー,2019年1月12日,5,すごくいいです。 是非インストお願いします！！,0
2554,臥龍岡璃穏,2018年10月6日,4,すごく使いやすくて良きです(*^^*),0
2555,チャンネルゆっこと,2019年1月1日,5,ほんとにこのアプリはすごいと思います,1
2556,Megumi Abe,2019年7月15日,4,好きな曲があるし最高,0
2557,こにしますみ小西ますみ,2019年8月12日,5,これ神まじでネットサーフィン中でも曲聞けるしYouTube藻見れるから神,0
2558,Googleユーザー,2019年2月6日,5,好きな音楽がきけていいとおもう,1
2559,Googleユーザー,2018年10月13日,5,これって外でユーチューブ見てるってこと？ ㌐いかないのね？,4
2560,山口淳菜,2019年1月25日,3,まだよくわからないのにレビューはむり,1
2561,林ミカ,2018年10月16日,5,まだ始めたばっかですがこれからな楽しみです！,2
2562,noriko,2019年6月21日,5,聞きたい曲が聞きやすいです。,0
2563,Googleユーザー,2019年4月1日,4,これからはこれを使おう❗と思うほど使いやすい❗よ＼(^_^)／,0
2564,モンローまりりん,2019年2月15日,5,とっても良いです！？ どんだけ～((☝))( 亝👄亝)笑笑,0
2565,黒蝶桜夜,2019年1月21日,4,星5評価してください が表示されなければもっといいとおもいます。,1
2566,Yukiyo Nakamura,2018年12月27日,3,まだ使い始めたばかりで分かりませんが これからも楽しんで利用できることを期待しています。,1
2567,はちみつ,2018年11月18日,5,まだインストールしたばかり… なにもわからない,2
2568,山崎昇陽,2019年6月1日,5,検索しやすく高年齢ユーザーにもピッタリだと思う。,0
2569,佐々木響,2018年12月9日,5,かなり使いやすい,1
2570,岡部三枝子,2019年1月10日,2,アルバムの曲がたくあったら良い,0
2571,松﨑寿春,2019年1月13日,5,とてもいいアプリです!!!!!!!!!!((( *´꒳`* )),0
2572,Googleユーザー,2018年11月18日,3,今ダウンロードしたばかりで分かりません！,0
2573,miku sod,2019年10月2日,5,わかりやすい、使いやすいです,0
2574,いわすあゆこ,2019年4月21日,5,★５にしろと言われたからした これで満足か？,1
2575,Googleユーザー,2018年10月20日,5,動画も見れていい,0
2576,だいちゃエアライン,2019年1月12日,5,望んでいたアプリをついにみつけました！,1
2577,佐藤雄紀,2019年5月16日,5,聞きたい曲が聞けるので嬉しいです,0
2578,浅井幸雄,2019年2月13日,5,使い始めたばかりですが、いい感じです‼️,0
2579,まさひらた,2019年1月20日,5,懐かしい曲がいっぱい聞けてうれしい‼️,1
2580,さくら。,2019年10月22日,4,いいアプリ 使いやすいです。,0
2581,Tei Shibata,2018年11月13日,3,インストールしたばかりなので、分かりませんが、良さそうです。,1
2582,Googleユーザー,2019年3月26日,3,まあまあ、誰が歌っているか分かるといいね,1
2583,Googleユーザー,2018年9月17日,5,まだ始めたばかりで詳しくはわかりませんがとても使いやすいです,0
2584,Googleユーザー,2018年11月11日,5,凄くいい！勉強の時調べながら勉強出来て嬉しい！,1
2585,Googleユーザー,2019年3月16日,5,⚪⚪⚪さんのホクロが夏の大三角形なんだよねってこと！,0
2586,あい,2018年10月26日,5,今のところいい感じに使わせてもらってます☆,2
2587,日本人であることを誇るべきだ,2019年7月29日,5,ユウチューブで見てもいいと思いましたがこれでもいいと思いました　　　　　　　　　　　　　　　　　　　　　　　　　　　　　,0
2588,the Human Frisk,2019年9月25日,5,非常に万能　これからも精進してください！,0
2589,Googleユーザー,2018年12月21日,5,愛用できるアプリですよ！,1
2590,FKクランメンバーのアイスベリー,2018年12月31日,3,試しに、ロキ、て、曲。聞いたら、ハマった。!,0
2591,三上務,2019年2月19日,1,まだ分からない、使い方が分からない。,0
2592,Googleユーザー,2019年1月1日,5,まだ使い始めたばかりなので、よくはわからないがいい感じかな。,1
2593,むぎむぎ,2018年11月28日,5,使いやすくて好き！,0
2594,pochiko saiore,2019年2月1日,2,まぁまぁ便利。,0
2595,Googleユーザー,2018年12月3日,5,気に入りました！,1
2596,ゴジベジ,2019年6月25日,3,外で利用したときどれくらいギガ使いますか？,0
2597,Googleユーザー,2019年2月20日,5,最高！ こんなアプリ探し求めてた！ (๑ ᴖ ᴑ ᴖ ๑),0
2598,Googleユーザー,2018年10月31日,5,今から始めますけど、なんとなく良いみたいです,2
2599,Googleユーザー,2018年10月28日,4,ゆずの曲もっと増やして欲しい…,1
2600,Googleユーザー,2019年2月23日,4,良いアプリだと思う 使いやすいと思う,0
2601,Googleユーザー,2019年2月3日,5,他のアプリを見ながらがいいね,1
2602,先延ばs,2019年9月20日,1,検索できなくなってるけどどういうこと？,1
2603,かくうなまえ,2019年6月29日,4,今のところ使いやすいかも もう少し使ってみます,0
2604,やっきりーよ,2020年1月9日,5,使い方が分かりやすい,0
2605,塩谷栄美,2019年1月5日,5,他のアプリを開いている時音楽を聞けたからいい‼️,1
2606,Googleユーザー,2018年9月14日,5,検索して自分のお気に入りを 作れるのがいいね,0
2607,Googleユーザー,2018年9月22日,5,最高ですが消しても大丈夫にしてください,0
2608,岩田直樹,2019年10月7日,4,気に入りました！,0
2609,Googleユーザー,2018年9月23日,5,オフラインでも使えるから(* • ω • )b,2
2610,横山良枝,2018年12月28日,5,結構使いやすい,0
2611,Googleユーザー,2018年10月15日,5,文句の付けようがないです。最高😃⤴️⤴️,2
2612,葉子園部,2019年1月10日,3,なんか分からないけど良いとおもう！,0
2613,Googleユーザー,2019年1月22日,5,まだあまりよくわからないけど、使ってみます,1
2614,クソ提督yama,2019年1月12日,5,(・∀・)ｲｲﾈ!! ｻｲｯｺｳﾀﾞﾈ!!,0
2615,Googleユーザー,2018年12月22日,1,はっきり言うけどこれ、YouTubeとかわんないよね？,1
2616,Googleユーザー,2019年3月5日,1,（ね）へ）ひやはなしせねよはれ？りなす にね（（のなやはやにのほやり（にゆきたかつてけてにねこゆぬか,2
2617,トラニャス,2018年10月4日,5,これって通信料ってどのくらいかかるのかな？ 気になるのはそれくらいかな,4
2618,さんたあ,2019年1月12日,5,まだ使いこなせてませんが、楽しみです🎵,0
2619,いち,2018年10月4日,5,初めて音楽アプリを利用しました アラフィフな私でもとても分かりやすいです,5
2620,ダンブヨ師匠,2019年2月2日,5,素晴らしいです。作った方ありがとうございます！,0
2621,Googleユーザー,2018年10月29日,5,まだ使いなれていませんが良い感じです。,2
2622,つじのひかり,2019年8月2日,1,ダウンロードが保留になるんです。どうやったらいいですか？(><),0
2623,Googleユーザー,2018年11月25日,3,たまに流れなくなる,0
2624,Googleユーザー,2018年10月7日,5,なんかわからんけどめちゃめちゃいい！,1
2625,森田敬介,2019年7月23日,5,扱いやすいです,0
2626,西田晶恵,2019年10月14日,1,分かりにくい、使いにくい🎵,0
2627,ぶるーべりーありりん,2019年3月11日,1,ただのYouTube視聴アプリ,0
2628,Googleユーザー,2018年11月6日,5,とったばかりなのでまだわかりませんが、良さそうです‼,2
2629,Googleユーザー,2019年2月2日,4,とても良いと思う❤　　 このアプリを入れて良かった‼,0
2630,Googleユーザー,2019年3月26日,3,スリープ状態の時聞けないのが残念,1
2631,北川勇,2019年1月12日,5,よい歌が聞けてる,0
2632,Koharu,2019年6月23日,5,ジャニーズJrのも聞けていいですよ！,0
2633,飯田幸子,2020年4月12日,5,色々な曲聴けて最高😃⤴️⤴️です,0
2634,君のハートに狙い撃ち!!,2018年9月26日,5,５をすすめてくんのはうざいとおもった なぜかアプリの途中でおわるなぜ？,0
2635,遙1117,2018年12月10日,2,使い始めだからなんとも…ダウンロードの仕方がわからない,0
2636,佐藤天空,2018年11月16日,5,すごくやりやすいと思います！！,1
2637,Googleユーザー,2018年12月16日,5,使い始めたばかり。笑,0
2638,yu ishika,2018年11月27日,5,よかです！ありがとうございます。,0
2639,RUNラン,2018年11月1日,5,とても使いやすいです‼️ありがとうございます😊,1
2640,Chara Dreemurr,2019年8月21日,1,ダウンロード出来ないのがなー,1
2641,Googleユーザー,2018年12月10日,5,いい！星5です！頑張って下さい♪,1
2642,藤岡賢,2019年1月13日,1,他の音楽アプリの方がよっぽど良い❗️,0
2643,Googleユーザー,2018年9月29日,5,沢山の曲を見たかったら、強制星５？w,2
2644,Googleユーザー,2018年12月8日,5,まだ分かりませんが、たぶん良いです(笑),1
2645,カイザー,2018年12月22日,3,今、インストールしたばかりで何もしてないのでわからない,1
2646,Hideaki I,2019年5月9日,5,すごいです‎*。ヾ(｡>ｖ<｡)ﾉﾞ*。,0
2647,Googleユーザー,2018年12月20日,5,とっても良いよ。私は文句なし！,1
2648,Googleユーザー,2019年3月24日,5,わかりやすく、とても良いです！,0
2649,三宅里菜,2019年4月5日,2,強制終了する、早く直してください,0
2650,マイ うごメモ投稿ナップル,2018年10月25日,1,ゴミアプリですね皆さん入れない方がいいですよ,3
2651,Googleユーザー,2018年10月28日,5,よくわかんないけど、つかえてる、,1
2652,Googleユーザー,2018年10月20日,5,まだ始めたばかりだけど、分かりやすいです,2
2653,あかはる,2018年12月25日,5,まだ分かりませんが、いいのかなーと思います。,1
2654,maryl love kitty,2018年10月30日,5,全部分かりませんでしたm(._.)m,1
2655,のざたた,2018年10月11日,4,wifiなしで聞けるよーにしてほしい,1
2656,フカヒレまんじゅう。,2018年12月8日,5,使いやすくて大好きですありがとうございます٩(๑❛ᴗ❛๑)۶,1
2657,Googleユーザー,2019年1月14日,5,いいと思います。 宿題にも役立ちます🙇,1
2658,Googleユーザー,2019年3月22日,5,いっぱいあるから 曲を探しやすい❗,1
2659,令子飯田,2019年11月7日,3,良いかな？！です。,0
2660,イナロー48,2019年1月6日,5,面白いし検索しやすい🎵,0
2661,Googleユーザー,2018年12月6日,5,とても使いやすいです,0
2662,Googleユーザー,2018年11月23日,5,とても使いやすいです,0
2663,ソーン,2018年10月7日,5,とても使いやすいです❗❕,1
2664,ウィザード骸使いの,2018年12月30日,4,ありがとうございました あたまかなやなあかふにかちにひさひなはなはなはなはなはねはなはなさはにらはしひらぬさはるひさひにひ,1
2665,焔連,2018年10月27日,5,凄いつかいやすくて良いですね(*•̀ᴗ•́*)و ̑̑,2
2666,Googleユーザー,2018年11月25日,5,いいと思う(星５にした方がいいのかな？),0
2667,きあず,2018年11月15日,4,好きなアーティストを選ぶからいいね,1
2668,Googleユーザー,2019年6月6日,5,とても使いやすいです,0
2669,奥村理子,2018年12月7日,5,とても使いやすいです,0
2670,小林晋,2019年6月22日,5,音楽は最高で～す!!!!,0
2671,儀間栄絵,2020年2月1日,5,つかいがってがよいので最高ー,0
2672,9月の約束,2019年1月24日,5,ツイキャスとかにもできるのかな？,1
2673,千葉恭章,2018年12月4日,5,楽しんでます。ありがとうございます。,0
2674,さみぃ,2018年9月13日,5,好きなアーティストが出てくるしいいと思いました ！,0
2675,江頭真悟,2018年10月25日,5,まだわからないけど、とりあえず…,2
2676,Googleユーザー,2019年1月21日,5,とても使いやすくて(๑•̀ㅂ•́)و✧ｸﾞｯ!,1
2677,Googleユーザー,2018年10月3日,5,開いたばかりですが。良さげ。,1
2678,にゃんちゅう,2018年11月6日,4,いいかも。勉強中に良いですね。,1
2679,Googleユーザー,2018年12月19日,5,まだ使いはじめなので！・・・・,1
2680,Googleユーザー,2018年11月12日,3,使う前に聞かれても分かんないです,1
2681,Googleユーザー,2019年2月19日,5,良かったです。 まぢでいいよ！,0
2682,無銘餅屋,2019年2月23日,5,愛用させてもらってますヽ(・∀・)ノ,1
2683,板垣大助,2019年4月4日,5,オフラインでも聞けたらな・・・,1
2684,Googleユーザー,2019年1月19日,5,まぁまぁよいアプリです,0
2685,Googleユーザー,2019年3月1日,5,好きな音楽を聴けるのがいい,0
2686,Googleユーザー,2018年10月7日,3,ダウンロード出来てるか分からない,2
