,name,date,rating,content,like
0,岡﨑愛,2020年4月19日,2,アプリをダウンロードしたばかりで、バックグラウンドで聴いています。星の理由は曲のダウンロードが出来ないこと、聴いている途中で止まり（3分一曲につき8回程）、イヤフォンのコントロール機能では2回押さないと再び再生が出来ないこと。また、それでも再出来ずに広告のような音楽が流れることです。他のアプリは分からないので使用していません。曲数が多いのは良いと思います。ですが曲を聴くことに支障をきたす程なので、改善して頂きたいです。,3
1,芝刈機翼鷹怨,2020年4月14日,5,,68
2,枝垂れ桜,2020年4月9日,5,"ダウンロードはネットが必要ですが、その後はオフラインで聞くことが出来てとても便利です。 オフラインで聞けないという人は、 曲を""プレイリスト”に追加(この時点ではオフラインでは聞けません)→追加したプレイリストのところから聴きたい曲をダウンロード をするとダウンロードした曲が""オフラインプレイリスト”に入るのでオフラインで聞けると思いますよ。",129
3,横井詩 uta,2020年4月4日,4,広告をあまり見たくない方は、下のタブにある本人→右上のアイコンを押すと、30秒間の広告を見る代わりに、6時間広告を見なくてもよくなります。基本的には何でもダウンロードできるのでいいですね。拡張子がmp3の方がm4aなのが良くも悪くも、って感じです。,33
4,りんごあめ,2020年4月3日,1,音楽をダウンロードしようと思ったら、ダウンロードマークが無くて、追加しかない状態だった。その上どれだけ待っても再生ができない。しょうがないから追加だけでいいかと思って追加を押したらエラーが起きるのでとても不便です。どうにかできないでしょうか？,40
5,大西みや,2020年3月23日,5,個人の感想ですが、色々な曲が聞けて使いやすいし、とても便利なアプリだと思います ですが、歌詞が表示されないのとされるのがあってややこしいです。 出来れば曲全部を歌詞付きにしてください。 よろしくお願いします^^* これからも頑張ってください,50
6,猫人間,2020年4月2日,5,このアプリの良いところは720画質でYouTubeの動画をダウンロードできる所です。広告も凄く少なく、広告がでたら戻るボタンを押すとスキップできます。 非常に残念だった所はiPadにこのアプリがなかったことです。,4
7,RINK,2020年4月10日,4,とてもいいです！オフラインで使えて、音声だけダウンロードできる点もいいと思います。 ただ、プレイリストを作っても決められた順番でしか再生できないので、シャッフル機能がついているともっといいなと思いました。また、ときどきダウンロードができないことがあります。 これらのことから、星4の評価です。,36
8,狂いのさくらもち,2020年4月18日,4,曲のダウンロードも出来て愛用させていただいてます！ 1つ気になることがあるのですが 再生リストを並べ替えて再インストールした時に開いてみると元の場所に戻ってるんです… それが直れば完璧！星5！！(),3
9,アムロレイ,2020年3月24日,5,いろんな音楽アプリを使って来ましたが、バックグラウンドで聴けるアプリがなかなか無かったので重宝してます。 しいて言えば、オリジナルが聴きたいのに、歌ってみた！っていうのが多すぎて検索が大変です。,8
10,暁鈴,2020年4月8日,5,自分が求めていたものが手に入った感じです！とても良いと思います容量を使う代わりに(71曲ダウンロードしましたが容量1Gもとりませんでした)ネットは本当に使わないので凄くいいです！これからも愛用しようと思いますありがとうございますm(*_ _)m,22
11,sakuhana_TAMASAN2019 tamami sato,2020年4月12日,4,オフラインで聴けて、しかも プレイリストに入れた曲の順番が変えられて嬉しい！ 音も良い！ですが、フルヴァージョンの曲が少ない、もう少し沢山聴きたいです！フルで！ お願いします。,0
12,SI -,2020年4月9日,5,,43
13,中杉忍,2020年4月11日,3,大変使いやすく、楽曲をダウンロードさえすればオフラインでも使えるので重宝します。 しかし、使って行くうちに、広告の頻度が多くなるので、広告の量には気をつけて頂きたい所存にございます。,0
14,あやあや,2020年4月4日,5,使いやすかった。 何だこれ、すごい使いやすい! 絵を描いてるときも聞けるのはほんっと有り難いです! しかもダウンロードできちゃう。 最強でしょこれ。 ありがとうございます!((*_ _))ﾍﾟｺﾘ,9
15,Eve FPS,2020年3月21日,5,自分は、まずWiFiを使わなくても使えると言うことが目に入りました1回インストロールしてやってみましたがほんとにWiFiを使わなくてもできたのであっ曲を入れる時は、WiFiを使いますがそれ以外は、ほんとにWiFiは、使いません！今でもこのアプリは、好きで朝、昼、夜聞きながらやったり、音楽を聴きながらYoutubeを見ながらでも！なので好きです(*´ω`*),308
16,桐谷真央,2020年4月8日,3,とてもいいアプリだとは思いますが、 曲のダウンロード方法がよくわかりません。 説明を細かく記載していただけたら嬉しいです。また、無料会員の人はシャッフル再生で、広告がかなり多く入ってくるので少し使いにくいです。 それ以外は完璧だと思います。,4
17,すちがみ様,2020年3月17日,4,オフラインで再生できるのがいいと思います。ギガをなるべく外では使いたくないので、家でダウンロードしておけば、外でも聞けるのがいいです。お気に入りなども設定できるのでダウンロードした曲を探す手間が省けます。動画再生でもダウンロードできるので、歌詞着きなどを探し歌詞を見ながら歌えるのがいいです。でもたまに広告が出るのですが、探した曲の一覧の間間にあるので、間違って押してしまい、広告動画を飛ばすのが面倒です。それを気にしない人は完璧なアプリだと思います。凄く便利です。これからも使わせていただきます。ありがとうございます。,114
18,kana mya,2020年2月2日,4,たまに曲の保存が出来なくなったりして 少し戸惑う事もあるので星4にさせて 頂きました。しかし、広告も最初に チラッと出てくるだけでそんなに気にならないし、とても良いです！！また画面を消しても曲が流れてきてくれるので とても重宝しております！,16
19,小番英子,2020年2月7日,5,個人にあった曲の検索で一番好きな曲が聴ける事が出来ました。ミュージックチューブ配信が終了した為に、個人の気にいった曲はミュージックチューブ、履歴の消去だけで聴く事が何よりも好きでした。個人差もあり、演歌・フォークソングは全く興味がないです。仕事の時はなるべく聴く時間がないので、休みの日に視聴するのが私の癒しです。,39
20,太陽になりたい,2020年3月16日,5,,65
21,こう,2020年3月28日,4,とってもいいアプリです。ですが最近 、アプリを開いていないのにバックグラウンド再生が開いてしまいます。unknownなので曲が流れる訳では無いのですが、気になってしまうので出来れば改善よろしくお願いいたします。,30
22,ベイビーポケット,2020年3月28日,5,控えめにいって神アプリ。まぁなぜかというと曲をダウンロードする際にはギガをあまり使わないこと。また、wifiなしでもすらすら曲が聞こえることです。アプリが落ちるといっている奴ばデバイスが悪いだけからいちいち運営さんを困らせすぎ。運営さん、もっといいアプリになるようにこれからも頑張って下さい！,1
23,れちなみ,2020年4月15日,5,曲をダウンロードしただけで、本当に無料でオフラインで聞けて、凄く良いアプリです！ずっとこのアプリを愛用したいと思います！このアプリを作って下さった方々本当にありがとうございました！,0
24,骨伝導オク下,2020年3月24日,5,これはよい音痴改善メーター 音階ごとの周波数をスマホに (とれみふそらし)+い(#)で辞書登録 (例 ド→と261・ド#→とい277 ) 歌詞をひらがな化して周波数を記入 楽譜が読めないのでこうして音程を 視認して発声練習してます きっちり当たってる時間が至福です♪,2
25,NᏐᏚᎻᏐᎠᎯ,2020年3月26日,5,とても使いやすいです！ ただ1つ、プレイリストに好きな曲を入れて 順番変えてると勝手に曲が元の位置に 戻るとこが改善されればなと思います！,0
26,にゃこねこ,2020年3月8日,5,Android5.1で使わせてもらっていたのですが、突然曲をDL出来なくなりました。 インストールし直しても使えません。 対応しなくなったのでしょうか？すごくお気に入りだったので、また使わせてもらいたいです…。 追記:久しぶりにDLしてみたらちゃんと出来ました！！本当にありがとうございます！！！ 有難く使わせていただきます。,76
27,白瀬ちぃ,2020年1月26日,5,僕、お外でWiFi繋がらないので 外でも音楽とか動画みたかったりするんです！それでyoutube からダウンロードできるアプリ探してて、これ！とても最高です！ エラー発生するバグ治してくれてありがとー！！！かれからもつかいます！,15
28,はいじー,2020年2月18日,5,控えめに言って神。MP3、MP4で選んで保存可能で、もちろんオフラインで再生できる。画面消しても、他のアプリ使いながらでも継続して流せる。本体にダウンロードできるからMP3ならアラームとかにも使えるし、YouTubeのあらゆる動画がある。本当に非の打ち所がない,174
29,片山ホーム,2020年4月2日,4,よく使っています！！でも、次を再生するシステムが欲しいです。あとはいいんですが、、、。あと、便利すぎて、、、法律的に大丈夫なんでしょうか？？YouTubeのものをダウンロードしていると思うので、、、。ちょっと心配です😅,7
30,SDBH肩こりゴジータ,2020年3月24日,3,途中まで良かったのですが、ダウンロード完了数が160？回超えると100件くらいダウンロードしたのが消えてしまいます。( ；∀；）お早めの対処お願いします(´･ω･`; ),17
31,佐村河内守男,2020年3月31日,5,オフライン・ダウンロードの意味をこちらが勘違いしているだけかもしれないが、機内モードにすると聞けなくなる。 ただ、便利そうなので使います。,0
32,小林ゆめ,2020年4月11日,2,とても良いのですが、ダウンロードができなくなってしまってオフラインでは聞けません。あと、スマホを閉じると曲が止まったりします。前はそんなことなかったのですが…改善して欲しいです。,0
33,梅おにぎり,2020年4月16日,5,使いやすいが、ステータスバーのところのバツ印を押すとアプリが再起動する仕様を変えて欲しい。いちいち再起動した時間を待つのが面倒くさい。,0
34,川村こよ奈,2020年4月4日,5,まじで神アプリ！どの音楽アプリも電源切ると勝手に音楽切れちゃうけど、このアプリは電源切っても聞けるから電池の消費とかに最適！音楽切りたい時もすぐ消せるからめっちゃいい！今までのアプリで一番いいアプリ！,2
35,温井お茶,2020年4月18日,5,本当にオフラインで聴けて今まで入ってない曲が見つけられたりと凄く便利なのでオススメです！！あと音割れ？があるのでそこさえ直してもらえれば最高ですね,0
36,めいめい推し,2020年1月28日,3,黄色の時から愛用させて頂いております。 とっても良いアプリです。 ただ、一つだけ直して欲しいところがあります。 それは、黄色のアプリでダンロードした楽器を青色に以降出来るようにして頂きたいです。 どうかご検討をよろしくお願い致します。,4
37,- KAGURA,2020年3月19日,1,ついにフリーズしてアプリすら開かなくなりました。最初の頃とは違って更新があってからは会社の利益を優先するために広告を大量に表示しまくるようになりました。そのせいか最近はずっと起動すら出来ない状態です。初期の頃から愛用してきましたが、もう諦めて今日でアンインストールする事にします。信頼していたのに裏切られた様で本当に残念です。 追記・相変わらずゴミ(笑)なにが改善したって？何も変わってねーだろwwwエラーばっかでろくにダウンロード出来たらもんじゃねぇ。こんなゴミ糞運営野郎がいくら改善無駄だろ(笑)本当無駄に期待させやがって,212
38,小泉里穂,2020年2月25日,3,とても使いやすいんですが、オフライン音楽プレーヤーなのにオフラインだと聞けないのはどういうことなのでしょうか？また、1回1回の反応が悪いと思います。WiFiの環境下なのでもっとサクサクと動いてください,43
39,如月蓮,2020年4月5日,3,動画で見れてあんまりギガも使わないからいいと思う ただ、何故か途中途中途切れたり、止まって消えたりしてることがあるからちょっと………ってとこはあります,0
40,Puregold,2020年4月18日,5,今では普通なのかも知れませんが、ホームボタンを押しても音楽が止まらないことに感動してます☆使いやすく楽曲数が多くお気に入りです👑,0
41,TKR 、,2020年4月17日,3,音楽がオフラインで聞けると聞いてこのアプリを入れたのですがダウンロードの方法をアプリ内で分かるようにするともっと良いと思います 音楽の質はとても良いと思うのでこの点数にさせていただきました,2
42,Googleユーザー,2020年3月8日,1,「エラーが発生しました。もう一度試してみよう」って出てダウンロード出来ないのなら、表示しないでくれ　あと音楽じゃないのも表示しないで 追記:これはバグなのか？削除した覚えがないのに曲が突然、端末から消えてるんだけど　 削除しちゃってももう一回ダウンロードできるようにしてほしい,22
43,mai mai,2020年2月11日,5,とても使いやすくて愛用しています。最近、携帯をAndroidからiPhone XRにしたのですが、iPhoneXRに対応していないみたいで、このアプリが見つかりません。iPhoneXRに対応して欲しいです。よろしくお願いします。,3
44,norik S.,2020年4月5日,4,勝手に、曲を飛ばすのが、最悪です。全曲演奏しません！聞きたい曲が、聞けないアプリだけど、無料だから我慢してます。,0
45,中村眞司,2020年4月17日,5,中々良くできたアブリ。ダウンロードの仕方がよく分からない。が曲がそろつてて楽しめる。他のアブリは曲が検索ひくとあまりない。でこれがいい。,0
46,恨み恋:82:,2020年2月29日,4,曲を追加しようとすると、 作成した時のはじめの曲は 入っているのですが、次にまた同じリストに違う曲を追加しようとすると何故かアプリが閉じてしまいます。 いつもよく使っているので、改善の方、宜しくお願いします。,5
47,岩永実桜,2020年3月11日,5,アプリのバックグラウンド再生など出来ることが多くていいです ただ、アプリを消すと音楽が止まるのが 少し困ります ニコ動は消しても止まらないんですが… 他はとてもいいと思います,0
48,あめちゃん,2020年3月21日,4,自分の好きな歌をインストールして、聞けるってことはいいんですが、急にインストール出来なくなってしまいました。これはどういうことか分かりませんが、インストール出来なくなってしまったことは少し悲しいです。,0
49,Off Take,2020年4月15日,5,オフラインでも音楽が聞けるのがすごいと思う。 しかもバックグラウンド再生も出来て万能と言える。 だから広告はしょうがない,0
50,内村華織,2020年3月31日,4,オフラインで聞けてとてもいいアプリだなと思いますが、最近全く曲がダウンロードできないのですがこれはどういうことですか?早めの対応お願いします。,1
51,メリオダス,2020年4月4日,5,今までの中で一番良い！何よりスリープモードでもホーム画面にいるときでも聞けるし何より無課金、音質もよいし申し分はない。,0
52,田中伸弥,2020年2月8日,4,ダウンロードも簡単で、曲もたくさんあります！ ちょっとダウンロードした曲が多くなると新しくダウンロードするとき遅くなるけどそれ以外は全然問題ありません！ 良いアプリですよ～👍,64
53,ゆっくり春チャンネル,2020年1月26日,5,良かった、今日起きて直ぐに入れたい曲をやってみたら、ダウンロード出来て、嬉しさのあまり発狂してました!!!改善の修正有難うございます!!!これからも、愛用します!!!,47
54,まさるTV,2020年2月29日,4,たくさんの音楽が聞けてとても使いやすいアプリで、僕はAndroidを使っていて機種が原因か分かりませんが画質が悪いです よければ画質を良くして欲しいです。,1
55,野口祐也,2020年3月24日,4,ある程度は問題ないから星4位かな。 たまに落とせない曲も有るから。 でも曲は多いし落とせばオフライン再生可能な点は良い。,0
56,Mimika轟の嫁,2020年4月3日,4,あーこれYouTubeのをそのまま再生するだけなんね。てことはYouTubeのプレミア会員入る必要ないんじゃないかな、、w これで色んな曲聴いてるし容量軽いので愛用させてもらってます！,0
57,クラリネット奏者,2020年2月24日,5,とても使いやすいです!他のアプリを使いながら流せるアプリを探してたんです!曲のダウンロードも、とてもわかりやすく私は気にってます (・∀・)ｲｲﾈ!!(・∀・)ｲｲﾈ!!,3
58,o atsu,2020年4月15日,5,YouTubeで聞くよりめっちゃ快適。音楽を頻繁に聞く人や、勉強や作業をする時に音楽を聴く人にはおすすめ!!!!,0
59,前田ピカ,2020年2月8日,4,すごく使いやすいので愛用しています！ けれどスマホを変えたら曲をまたダウンロードし直さないといけなくてすごく大変でした。 引き継ぎ機能をつけて頂けると嬉しいです！,4
60,めい,2020年4月10日,5,とっても面白いです！ 課金なしで出来るのでとても便利です。 インターネットなしでも聞けるのも良いです。,0
61,マンゴーリンゴ,2020年4月9日,4,音量調整ができるように、してほしいけど、別のアプリを開きながら、好きな曲が聞けるのでかなり楽しいです。,0
62,或守鞠亜,2020年4月13日,5,画面を消しても曲を 聞くことによって 充電もあまり減らないし それに、たくさんの曲があって 個人的には好きなアプリです,0
63,プラマイ,2020年2月2日,1,曲をダウンロードしようとしても出来なかったのでプレイリストも作成できず1曲ならできたのですが他の曲が入らないとなるとプレイリストの意味が無くなってしまうし、そもそも曲が聞けないので使うことが出来ませんでした。,100
64,みかちん&まっすーラブ,2020年2月23日,3,お気に入りの曲があり、オフラインでも聞けるのが嬉しいけど、中国語なので説明がわかんない。日本語にしてくれたら5なんですけどね。,0
65,チキンガーガー,2020年2月21日,4,曲を引っ張り出して閉じてても聞けるのはいいと思ったし、動画を保存できることがとても満足しました。けど関係ない動画などが出てきて困りました。間違えて押したりとか…,4
66,クラリネット吹き,2020年4月4日,5,広告も少なくいいです。 オフラインでも使えて、別のアプリを使っている際も音楽を聞けます。,0
67,高橋葵,2020年3月15日,5,ダウンロードしちゃえばいつどこにいても使えて便利です。広告も、ないからイラつくことがないと思うと思います。！歌が何でも出てくるし、音質がいいです。！,2
68,Masato Ryuzaki,2020年4月18日,5,よく本人じゃなくカバーや素人しか入ってないのがありウザいですが、意外な曲もあり音だけダウンロードできるのがうれしい。,0
69,まつおかまこと,2020年3月22日,5,J-POPから、洋楽、韓国、色んなジャンルの歌が聞けて、音楽もmp3.mp４としてダウンロード出来て大変良いアプリです。,0
70,かてりん,2020年3月2日,5,フルで視聴可能、バックグラウンド再生が可能で広告もない。 やっと最高の音楽アプリに出会えました。長く使えるのでおすすめです🎵,0
71,SR 0024,2020年3月13日,5,音質もいいし、他のアプリ使ってても音楽が聞ける。オフラインだからどこでも自分の好きな歌が聞ける。 歌もいろんな種類があるから凄くいいアプリだと思う。,0
72,Miiメイプル,2020年3月23日,5,定期的に使ってます！ オフラインで聞けるのがとてもgood⤴( ≧∀≦) これからも使わせていただきます！,0
73,坂谷雅生,2020年4月16日,5,最高です！アニメやゲーム主題歌がすぐ見つかる!懐かしいです！ アニメやゲームファンにはたまりません,0
74,h ovlesser,2020年3月18日,4,本当だったら4.5くらいですね 広告が特になくやりやすいですが 音楽を流すときにYoutubeって一瞬出てきて本当に4G掛からないのか？と思いました それ以外はとても使えます！！,0
75,no ko,2020年2月25日,3,オフラインで使えるのか？フライトモードでは再生できず。やり方がわからない。でもとても曲が探しやすいし幅が広いから、懐かしい曲も聞けて良い。,1
76,K K,2020年3月26日,5,これ最高だね！アプリを閉じても聞けるっていいよね！うん、これは、いいアプリだー！このアプリに出合って良かった➰😃,0
77,。。,2020年3月6日,4,かなり長く使ってて、とても愛用させて頂いてます。ですが、聴いている途中に勝手に止まってしまうことが多々あるので、改善おねがいします😭🙏🙏,53
78,山田希実,2020年2月3日,5,検索すれば色々な曲が聞けるのでとてもいいアプリだと思います！ しかも無料で聞けるのでとても嬉しいです！ ダウンロードもできるのでいいと思います！ 絶対ダウンロードした方がいいと思います！,11
79,杉めい,2020年3月8日,4,YouTubeの歌なので一般人が歌っているのとかダウンロードしてしまう事がありますが、検索もしやすくオフラインでも使えるので便利です。,0
80,あかさたなはまやらわ,2020年3月18日,4,ダウンロードしたらいつでもどこでも曲が聞けて嬉しいです。 でもダウンロードしたやつしか聞けないので全てがどこでも出来るようにしてくれたら嬉しいです。,0
81,小野寺舞,2020年3月25日,5,普通に使いやすい。 これでもう少しバリエーション豊富だったり望んでいた曲があると嬉しいなァ〜,0
82,N Yuri,2020年3月30日,2,これオフラインでどうやったら聞けるんですか？すべてプレイリストに入れてるのに再生されません。曲数は豊富な方なのでいいと思ったのに残念。,4
83,阿部真鈴,2020年4月17日,5,オフラインで聞けてとても便利です！！！ 曲も十分に聞けるので入れて良かったです！,0
