,name,date,rating,content,like
78,百瀬ゆいな,2019年5月9日,4,UIからプレイリストの同期に至るまで とても満足できるプレーヤーです ただ一つ不満があるとすれば 左手で操作してると並び替えのボタンに 頻繁に触れることになるので誤動作で 曲順がしょっちゅう入れ替わります 曲数多いプレイリストを扱う予定の人は それが煩わしく感じる可能性もあることを注意しておきます,3
79,Mar Chakochin,2018年10月2日,4,アップデートされてから、選曲すると画面が一番上までスクロールされるようになってしまった。 地味に不便。曲をタップしても勝手に上までスクロールしないように戻して欲しい。,0
80,長久保均,2019年6月20日,5,欲しい機能が全部ついている。 完璧です。 バグ報告　プレイリストから削除等の編集後に、再生中の次の曲等をタップすると、そのまた次の曲が再生される。,1
81,霜月,2019年9月29日,4,凄く使い勝手が良かったのだけれど、シャッフル機能を使ってないのに曲が並べてある順番通りに再生されなくなってしまいました 。色々試しましたが直りません…。,0
82,神谷葉月,2019年3月11日,1,音が波打ったように大きくなったり小さくなったりします。 以前はそんなことなかったので有料版のオプションを購入して利用してましたが今はとても使えるものじゃなくなってしまい残念です。,0
83,りむせ,2018年11月16日,4,普段からよく利用しています。S○NYのより使い勝手が良い。ただ、最近のアップデートでアイコンがかなりカッコ悪くなりました。以前の（2回前の水色のロケット型のもの）に戻ってほしいです。,1
84,加藤慎太郎,2019年9月21日,4,iTunesと同期して、使わせていただいています。ウィジェットで、ブレイリストの中身まで表示できるプレイヤーもあり、使いやすかったので、対応していただけるとありがたいです。,3
85,Googleユーザー,2018年10月10日,4,プレイリストの作成など聴くには十分なアプリだと思います、ただ日本語のmp3ファイルが文字化けするのがいただけないので修正してほしいです。タグを編集したら文字化けが直りました。,1
86,今田裕人,2019年8月6日,1,2019年8月時点で広告が露骨になった。 曲再生するとたまに5秒の広告動画が流れるようになった。 元の控えめな広告に戻らなければ乗り換えます。,0
87,乃.紫,2019年9月6日,4,最近SDカードに新しい曲を入れても更新されず、新しい曲が聞けません。 それの改善、もしくは手動で更新を行えるようにしてほしいです。 よろしくお願い致します。,0
88,Googleユーザー,2019年1月22日,1,曲の情報編集でタイトルなど変更すると曲が再生不能になって、元に戻しても再生出来ない。曲のデータがダメになる。,0
89,RED WOLF,2019年5月11日,5,アップデートしてから、曲を選んで再生したらプレイリストの最上部まで戻されてしまう。 追記:改善されました！ありがとうございます,1
90,つがるのあらいぶ,2019年3月31日,2,使い始めのころは良かったのですが、新しいファイルを認識しなくなってしまいました。インストールし直してもダメ。使えません。 早送り早戻しも出来ないので今は別のアプリを使ってます。,0
91,KK OY,2019年6月27日,5,非常にUIも良く使い勝手も良くて最高のアプリです。ただ急にプレイリストのスライド(ドラッグ)による曲の並び替えが反映されなくなりました…,4
92,石井克典,2019年6月17日,3,なんか知らないけど音楽が途中で勝手に止まると言う謎現象おきてる。いろんなこと試したけど全然直んない。これ、インストールする人は気を付けた方がいいよ,4
93,exi le,2019年7月1日,4,なかなか良いが・・・ 最低限使える。ただ、時折制御不能になる。こちらのスマホが悪いのか、バグか、不明。それさえ無ければ満点。,0
94,Googleユーザー,2018年12月15日,3,とても気に入ってたのに2018/12から聴いているだけでバックグラウンド通信が１日100Mオーバーして利用を停止中です。どうすれば通信しなくなるか教えてください,0
95,Ken Naguirra,2019年7月29日,3,再生ボタンを押した直後に広告が表示されるようになりました。これはけっこうストレスです。できればアプリを起動した時に表示するようにして欲しいです。,0
96,さつき&勘太,2018年9月28日,1,突然「音楽プレイヤーは再生できませんでした」と表示され、本当に音楽再生が出来なくなった 悲しい😢,1
97,T Sekiya,2019年7月6日,4,UTF以外の文字に対応したら最高。 wma対応してるし、曲情報の編集も出来るし、機能は十分。,0
98,小田切京子,2019年10月8日,2,おおむね良いのですが、曲を聞こうと思いタップすると広告が表示されるのはやめて欲しいです。すぐ聞きたいのに5秒でも待たされるのはちょっと…,1
99,Ryusuke Nagai,2018年11月12日,4,埋め込み歌詞の表示切り替えがやや煩雑なので、もっとシンプルに表示できるようにしてほしいです。,1
100,Kz A,2019年6月2日,1,急にフォルダを選択と出てきて使えなくなった。 それまで再生出来ていたファイナルも認識しない、フォルダも選べない 何年も使ってるアプリなのに残念,1
101,GE CK,2020年3月2日,5,感覚的に使いやすい！,0
102,Toshi Hata,2018年10月7日,2,外部メモリ(SDカード)に記録したデータが、突然再生されなくなった。原因不明、ダメですね...,0
103,加藤杏実,2018年9月15日,4,音質も良くていい感じだけど、 曲が1部表示されないのが気になる。他のプレーヤーでは表示されるのに…,0
104,mana ue,2019年8月7日,3,使い勝手が良いなので重宝してます。 ただ、最近途中で音楽が止まることがよくあって困ります。,1
105,Googleユーザー,2018年11月24日,5,再生出来ないゴミアプリの中これだけがSDカードの曲と携帯内部の曲が聞けた。他のアプリは皆詐欺アプリだった。これだけが良い。,0
106,Shota Mizuno,2020年3月7日,5,ituneと同期して日常的に使っています,0
107,Googleユーザー,2019年3月27日,1,alac対応とあったのにmicroSDに入れたalacの曲に反応しない。タイトルは表示されるのに再生されない。相性が悪いだけかもしれないけど残念でした。,1
108,ふうひら,2019年5月2日,5,他のアプリではパソコンから取り込んだファイルが再生出来なかったが、このアプリは再生出来て、とても使いやすいです。ありがとうございます。,1
109,ryo h,2019年1月24日,5,他のアプリで読み込みも再生もできなかったMP3もしっかり再生してもらえました。,1
110,Yoshinobu Yoshizawa,2019年6月18日,2,文字化けが酷い。 アルバムの編集が出来ないため、一曲ずつアルバム名、アーティスト名を入れないといけない。,3
111,casbah,2019年11月23日,4,本当に便利なアプリなんですが、文字化けするのが残念です,0
112,しっむ・るっぐ,2019年9月24日,4,タブの表示非表示を選べたり、スキンが豊富だったり、グリッド毎のサムネ数を選べたり痒いところに手が届く仕様がうれしい,0
113,横山慎哉,2019年4月5日,2,いきなり初期化のような状態になり、曲を全く認識しなくなってしまいました。,0
114,Ryosuke Omori,2018年9月24日,4,アプリの名前が音楽プレーヤーのままです、後曲の再生速度を変えられたらいいなと思ってます,0
115,拓真西崎,2019年4月13日,1,前はシンプルで広告なし本当に良いプレーヤーやったけど 今は広告が本当にうっとしぃ 新しいプレーヤー模索中,0
116,ぽろっぽー。,2019年3月7日,2,設定もわかりやすくて機能的には申し分ないけど、UIが大きすぎて一昔前のアプリを無理やり使ってる気分になる。,0
117,Googleユーザー,2018年11月6日,3,基本的な機能は申し分ないのですが、イヤホン接続時に勝手に音楽が再生されることがあります,1
118,ぷり大先生,2019年7月4日,1,曲順を変えても元に戻ります。直して下さい。メール送ったけど音沙汰無しです。早く直して下さい。,5
119,梶原貞雄,2019年2月12日,5,音質も良いし、音切れがなくイイです。,0
120,ko take,2019年8月15日,2,多分前回のアップデート以降 アプリが起動しっぱなしになるようになりました。 終了ができないです。,5
121,小川美保,2019年5月16日,3,音量キーが、ほしい。プレアンプで、若干できる。じゃなくて。,1
122,清貴津志田,2018年10月14日,1,ものすごく、電力 消費が、大きい。とても、使えない (>_<),0
123,ニチアサZチャンネル,2018年12月6日,2,途中で曲が止まって再生しようとしても曲が流れない,0
124,Googleユーザー,2018年9月14日,5,イコライザーのデシベル(dB)の数値を表示してくれたら最高です。表示されるように対応お願いします。,0
125,Natsu Natsumi,2018年10月19日,4,とても使いやすいのですが、何故か歌が２つ表示されます。,0
126,カッパ巻,2018年10月13日,2,操作と機能のできが良いだけにアイコンのセンス無さにとても残念です。昔はロケットのアイコンだったしね,1
127,川村研治,2019年3月3日,3,アルバムのタイトルと曲名が文字化することがある。 読み込まないフォルダがある。,3
128,Googleユーザー,2019年1月9日,4,開くのに時間がかかるし落ちます。操作も重いです…改善お願いします,13
129,影蜘凛KumoRin,2019年6月11日,3,広告が上に上がってくるようになってめっちゃ使いづらくなった,1
130,pochiaki,2019年8月5日,1,再生したい曲を選択した際に広告が表示されるようになった。,1
131,g lo,2019年3月27日,5,タブの並べ替えのやり方がわかりません‥‥ 他のことについては素晴らしいです,0
132,杉山博史,2019年5月30日,4,音質が良い イコライザーも使いやすいです スリープ設定があればなお良いです,0
133,Googleユーザー,2018年9月29日,4,機能や音質に関しては満足。アイコンがダサいのだけ変えてくれたら星5,1
134,masao kinjyou,2019年1月5日,1,ループ再生にしてるのに２曲再生したら止まってしまう❗️(-_-#),5
135,白ゴマ,2019年3月19日,2,急にwavの音楽ファイルの再生が出来なくなった。何故？,0
136,おおのひろ,2019年1月3日,1,データベースが壊れたとのメッセージが出て使えなくなった。,0
137,のみ,2018年11月13日,1,曲名が文字化けでグチャグチャ。 いちいちひとつづ直せって？ 編集する所がありません。 無理。削除。,1
138,きょう,2019年3月10日,3,追加ファイルが反映されなくて困ってます。リロード機能が欲しい。,1
139,To M,2018年12月16日,5,本当に無料でいいの！？　NePLAYER課金するよりオススメです。,1
140,T Y,2019年4月14日,5,素晴らしいアプリです wmaが再生できるアプリの中で最も優れたアプリだと思います アルバムの配置を変える機能はありますか？ なければぜひ作っていただきたいです！ アルバムの位置を変えて整理したいと感じることが多いので！,11
141,ボブボブ,2019年8月25日,2,流石に再生したいのに5秒広告挟むのはやめてほしい,1
142,ソルゲ組&梨子崇めよ,2019年7月14日,3,なぜか同じアルバムの曲が別れて表示される。なぜ？,0
143,ゆきぶう,2019年9月9日,1,アプリの更新されたら、聞けなくなってしまった！,0
144,i k,2019年4月14日,2,バックグラウンドで通信してるため怪しい…なぜ通信してるのか教えてほしい,0
145,謙一,2019年7月16日,1,再生ボタンを押しても再生しないことが多い,0
146,sham,2019年4月20日,5,有料のアプリは使った事無いのですが、無料アプリを試しまくって、これに決定‼️ ダントツで良い音です。,3
147,たまごやき,2019年7月14日,5,今のところは問題ないのでプレーヤーアプリの中ではお気に入りです。,0
148,中村雅,2019年8月12日,5,使いやすくて最高！ ずっと使ってます。,0
149,私はトキ,2020年1月9日,5,とても使いやすい！,0
150,Jam A,2019年2月18日,1,wanファイルが全部聞けなくなった！,0
151,*まつすけ*,2019年1月22日,4,アイコンがダサい。絶望的に。それ以外は概ね良いです。,2
152,nori n,2019年7月1日,1,wavが再生エラーで聞けない,1
153,Googleユーザー,2019年1月23日,2,アイコンが絶望的にダサい。 もっとシンプルなものに変えて欲しい。,1
154,やややややや,2019年7月24日,1,急に広告が入るようになった,1
155,克則,2019年9月14日,2,カーステレオにタイトルが反映されない,4
156,itisa saki,2018年9月28日,2,wma再生無料アプリランキング1位だったのでDLしたが wma再生は有料オプションだった,1
157,バーモンドカレー,2019年5月9日,3,プレイリストの削除ができません。どうすればよいでしょう？,1
158,NAO K,2019年9月7日,1,文字化けが多い,0
159,五十嵐悠真,2019年5月27日,5,使いやすいけどもちょっと重い,1
160,安室レイ,2020年3月10日,1,☆1個も付けたくない！ヘタレプレーヤー,0
161,ヨシロウドウハラ,2020年4月14日,5,めっちゃ使えてます。,0
162,長谷川啓,2020年3月28日,5,歌詞が表示されるんですか？,0
163,Mr CRT,2019年2月10日,1,突然アルバムアートが全部消えました 勘弁してクレメンス,0
164,謙太朗小口,2019年4月14日,5,やっと巡り会えた理想のアプリケーション。,0
165,うにゃこ,2018年9月30日,4,特に不満はないです。,0
166,黒猫zzz,2019年1月5日,1,再生できなくなった,0
167,かげめちゃ,2020年1月26日,4,これって、オフラインで聞いてギガかかりますか？,0
168,鶴田良夫,2019年7月11日,4,洋楽が好きで毎日聴いています。,0
169,macco saito,2019年9月19日,5,やっぱりこれが使いやすい！,0
170,Kotosome Necolli,2020年3月3日,3,シャッフルがいつも同じ順番,0
171,Hajime Atoji,2020年3月3日,5,素晴ら！！はい！！,0
172,松岡ゆう,2020年1月31日,5,いいとおもう,0
173,つっちー,2019年1月27日,5,次の更新お願いしまーーーーーーーーーーーーーーーーーーーーーーーーーーーーーーーー）ーーーーーーーーーーーーーーーーーーーーーーーーーーーーーーーーーーーーーーーーーーーーーーーーーーーーーーーーーーーーーーーーーーーーーーーーーーーーーーーーーーーーーーーーーーーーーーーーす。,0
174,しおしお,2019年5月22日,5,愛用してます！ これってiPhone iPadでも使えますか？,1
175,マリアトレイター,2020年3月27日,1,望んでいたアプリではなかった,0
176,山本ばなな,2019年5月6日,4,wmaが再生できるのは嬉しい,0
177,Yasuyuki Goto,2018年11月14日,5,普段使いしてるからです,0
178,LOL matstake,2019年2月3日,5,とてもいいよ。ジャスティン！,0
179,hongyi zuozuomu,2019年8月6日,4,#NowPlaying タグでシェアできるとうれしい。,0
180,UxKxB3000,2018年10月27日,5,最高のプレイヤーです,0
181,なんすば,2019年9月7日,5,wmaも再生できる。,0
182,k baroque,2019年9月2日,4,お世話になってます,0
183,p.m.9,2018年11月2日,5,オーこれはスゴい,0
184,mucchi4,2020年4月22日,4,,0
185,小野仁,2020年3月19日,2,Time43,0
186,チャリで来た。,2020年2月9日,4,機能自体はとても気に入っている。 UIはオシャレだし、カバーアートから自動で色抽出されるのもオシャレで好き。 ただ、昨日アップデートしたらアイコンがくっそダサくなってしまったので消したくてたまらない。 ホーム画面に置きたくないくらいのダサさ。元に戻してほしい… 2020/2/9追記 アイコン問題は割と早い段階で解決したので★4にしておきました。最近は、埋め込み歌詞のフォントサイズを変更できたらいいなーと思います。,14
187,Kazu SAEGUSA,2020年2月7日,1,"This app often causes system unstability. Once it happens, nothing but reboot can solve the issue.",0
188,山本貴志,2020年2月9日,4,とくにない。,0
189,山本卓夜,2020年3月8日,5,良いアプリ,0
190,世田谷千歳,2020年1月28日,3,Xperia5です。画面の半分しか歌詞が表示されないのが不便で見づらいので、全画面(に近い範囲)で歌詞を表示させたい。 また、イコライザを数字で入力できるようにしてほしい。,0
191,金子幸彦,2020年1月30日,5,使いやすい,0
192,ハコチャン,2019年7月5日,5,欲を言うならbpmの表示欲しいです。Zenfone５,0
193,Miho S,2019年6月27日,3,プレイリストの曲順の変更が反映されません。,2
194,アスカラングレー,2019年6月11日,1,アプリの見た目がださい。テーマじゃなくてホーム上にあるときのアイコンがださい。バックグラウンド再生のときの通知欄にあるやつに再生位置を変えられるバーが欲しい。,6
195,Googleユーザー,2019年6月12日,5,良いです。 有料版も買いました。フォルダ→フォルダ内のファイル全てのアーティスト名を書き換える を追加希望。,2
196,村田祥歌,2019年5月20日,5,"This application is easy for me to use. I like the best of all music players because I can change album arts what I like. If I have the chance to recommend for other people, I will.",0
197,YN KNG,2019年5月20日,5,OK ですよ °θ° ☆,0
198,アリエ,2019年4月21日,5,良い,0
199,Yuya F,2019年3月5日,3,,1
200,Ryusuke Sato,2019年3月25日,3,他の音楽プレイヤーアプリでは読み取れるタイトルやアーティストなどの音楽データ内に保存されているメタ情報が表示できない,1
201,rei ena,2019年1月23日,3,今さらだけどアイコンが前の横３角形の方がなんかしっくりくる…UI使い回しの量産アプリのアイコンみたいでなんか嫌だ,9
202,Cli Rig,2019年1月16日,3,What happened with the shuffle? It broke after the latest upgrade...,0
203,heidi,2019年2月1日,5,めちゃめちゃ優秀。,0
204,Googleユーザー,2018年11月16日,5,アイコン戻して 9/8 追記 アイコンがよりダサくなった 11/13 追記 なんでアイコン燃やしちゃうの…？ 11/16 追記 アイコンについての苦情をここに書いたところ、メールで連絡してくれとの事だったのでメールを送ると、以前のアプリのアイコン画像を送ってくれ、お陰でアイコンを戻すことができました。アイコンが気に入らない方は試してみて下さい。アイコンの変え方は「android アイコン 変更」等でググると良いと思います。,5
205,Googleユーザー,2018年11月13日,5,I love this app but suddenly it became very unstable after updating to v5.4.118. hope this fixed soon. Device:Motorola G6 (JPN edition) Android:8.0.0 2018/11/13 Thank you very much!!! Above issue is completely fixed with v5.5!,2
206,杉村亮,2018年11月16日,3,アイコンが変わったのはともかく、名前が「音楽プレー…」と表示されるのは何とかならんのかい。「Rocket Player」を先に表示させてよ。,1
207,Googleユーザー,2018年11月28日,1,why it keep poping up asking me to pay eventhough i have already purchesed premium ver?,0
208,majidoudemoii,2018年11月13日,4,なんでや！なんでまたアイコンださなっとるんや！元に戻してくれるだけでええんや！ プリーズ アイコン バック オーケー？,3
209,雲雀恭那,2019年4月10日,1,WMA対応のMusic Playerを探して検索をかけたところ表示されたプレイヤーだった為インストールしたが、対応していなかった。検索にわざと引っ掛かる様にしている様にしか見受けられない。速攻アンインストール。,0
210,zin fyk,2018年11月7日,2,作者さんがとても熱心な方で感激です。ですが、1分以上再生した曲に対して、戻るボタンを押したときに、頭出しされたり、前の曲を再生しはじめたり不安定です。　プレイヤーとして初歩的な機能なので5秒以内の再生以外は頭出しにする、など、修正を期待します！,0
211,METAL RESISTANCE,2018年11月4日,4,別のアーチストの同じ名前のアルバムが1枚のアルバムとして表示されるようになってしまいました。不便なので修正を望みます。,0
212,S Hsd,2018年8月30日,4,数少ないアルバムシャッフルできるプレイヤーとして重宝しています。ただ、アプリの名前が「音楽プレイヤー」で表示されるのが紛らわしいです。「Rocket Player」に戻してほしいです。,4
213,金子幸雄,2018年9月2日,4,音楽プレイヤーとして使いたい機能は揃っています｡1つだけ気になることは、「この曲の情報を編集」をして保存するとアプリが停止してしまうことです｡,0
214,中村祐一郎,2018年9月9日,4,私は、1時間以上の録音したラジオ番組を聴いたりするのですが、途中の30秒CMなどを飛ばすためにはシークバーは役にたたないので、設定時間をスキップするボタンや、vlcplayerのようにスワイプで早送りができるとありがたいと思う。,0
215,ikmt,2018年9月6日,4,概ね満足。 イコライザの設定を数値化してほしい。,2
216,No Hunter,2018年9月9日,3,上から再生にしてるのにシャッフルされるのはなぜ？,0
217,Googleユーザー,2018年9月16日,5,良かった,0
218,Googleユーザー,2018年8月28日,1,音質が良いのでPowerAmpからRocket Playerに乗り換えました。 デザインや操作性、ウィジェットは、PowerAmpの方が良いので、星３つ。 ハイレゾ、アップコンバートに対応していない。 ファイル名に「'」が入っていると再生エラーとなる。 PowerAmpでは正常に再生される。,2
219,usagigurumi pyonpyon,2018年8月15日,4,気に入って使っていたのですが先程、設定がいつの間にか変わっていて曲の再生中に画面がスリープするようになっていまして、元に戻すと今度はwmaが再生できなくなったと思ったら広告を消す設定になっていたからのようです。wmaが再生できなくなった際に再インストールしたら再生は直ったので、スリープの設定を変えようと設定画面に行ったら、また広告が消えてしまっていました。二度再インストールしましたが、何も変えなかった場合でも、設定画面を見ただけで広告の設定は変わってしまっているようです。役に立つかもと思いレビューしました。,1
220,ほんすぎ,2018年6月26日,4,機能的には広告もなくとても使いやすいです。ただ、今までは車のナビとBluetoothで問題なく利用できていましたが、少し前からナビの次曲へを押すとボリュームが上がってしまうようになってしまいました。他のアプリだと問題無く動くので少し残念です。,8
221,Googleユーザー,2018年5月15日,4,"iPhoneからの機種変でiTunesでの同期(別アプリ)やプレイリストの再利用が可能という事で入れてみたものの、同期した曲情報の日本語が全て文字化けしていてまったく使い物にならない。 
18/05/15追記 タグ文字コードをUTF-16にして文字化け無く表示されたので評価修正します。 あとは、並び順が読み仮名順になれば尚良しかな…",13
222,Masahiro Otani,2018年7月15日,3,"多くの拡張子、アルバムアーティストでの検索など他にあまりないものにも対応している。 
ただ、再生リストの扱いなどがよくわからない、インターフェイス自体もあまり感覚的でないなど気になる点も多く少し使いにくい。自動で次のアルバム、リストに移る機能も無く、その点が特に使いづらい。",3
