name,date,rating,content,like
新井永浩,2020年3月20日,1,最低、使いづらい❗,1
Googleユーザー,2019年1月24日,1,いらない、使えない、容量喰うのゴミ,0
石川康一,2019年6月26日,1,すぐ固まる使えんくそアプリ 一生ダウンロードできんやん金返せよ,0
四葉潤凛,2019年9月6日,3,歌詞が無いやつがある,2
Sakuya 389,2020年1月10日,1,LISMOを返しての一言に尽きる。いやほんと…LISMOを…LISMOを返して…戻して…(切実),3
ミュウ,2019年7月1日,5,お気にが沢山有るから嬉しいです。,0
北川裕基,2020年3月6日,1,検索が面倒,0
万能ネギ,2020年3月13日,1,リスモ復活して,0
Googleユーザー,2018年10月13日,2,強制終了されます。 改善をよろしくお願いします。,12
Ayaka K,2020年1月24日,1,LISMOなくなってから使いにくくてしょうがない 前のに戻して欲しい,1
Googleユーザー,2019年3月26日,1,新曲が遅い,0
Googleユーザー,2019年3月15日,5,まだ、使い始めたばかりですね。,2
ときたさとこ,2019年5月9日,1,便利では、あります。,0
椎名伊織,2019年11月3日,5,好きなアーティストが増えてきた,1
バッシーイシバシ,2019年8月25日,3,るりめめるみめまもめゆや　めゆめりひりひほ（そまむま（めもりゆ（まめめゆふまめり,0
誠次知念,2020年1月17日,5,か 約らな。な炉らヤろ、かほくほくそくるか、ろくかんぬわくらすしか、す、はや差さ宙奈ぬなかかはるさふふそすき重なっ、クコ拭かなかった残図抜けククサヌナスを！くくかくらゆかすく加湿器９月,0
Googleユーザー,2019年2月21日,5,使いやすくて、良いと思います。,2
宇佐美佳子,2018年12月3日,5,通勤が楽しくなりました,2
堺嘉男,2019年9月13日,5,楽曲が増えた,0
Googleユーザー,2018年11月21日,5,いい歌を宜しく,0
小杉山信子,2019年6月25日,1,使わない無用な機能,0
寛明亀岡,2019年8月18日,1,ストアに入れません。,1
しらねしょうじ,2019年4月7日,5,楽しく過ごしています。,2
小泉誠浩,2019年3月19日,3,大変聴きやすい,0
大槻海渡,2019年6月14日,1,何度も強制終了して困っている,2
うたまる,2019年8月24日,1,すぐエラー落ちする,0
深川美幸,2019年7月20日,4,そわは、たくかぎなたきくさかかこぬさたも任せて,0
maghreb qi-gong,2018年12月1日,1,勝手にダウンロードするな 凄い迷惑 くだらない,1
花澤明子,2020年1月28日,3,とても良い思います。,0
伊東道代,2020年4月9日,3,まだ聴いた事が無いのでわからない,0
NOBU S,2020年4月15日,1,無用の長物,1
徳永明子,2019年12月27日,4,うたパスはウォーキングの私の連れです,0
Blue Screen,2018年11月24日,1,要らないアプリ。削除したいが出来ない。,5
池西利規,2019年10月21日,5,ジャンルのこだわりがいい。,0
chiki 206,2019年4月27日,1,使いにくくするだけなら更新しないください。,4
佐名木辰雄,2020年2月16日,4,もっと古い曲もアップして欲しいです,0
Googleユーザー,2018年11月30日,5,このアプリを出しても 音楽が聞けないんですよね どうすれば うまくいくんでしょうか ペガサス,8
尾崎千勢子,2019年8月2日,3,聴きたい音楽が探しにくい？,1
Googleユーザー,2019年2月17日,1,アンインストール出来ない。邪魔。,9
岸弘海,2020年1月1日,5,ちょうどよい使用感,0
とよ子峯尾,2018年11月24日,5,これから使ってみたいなぁと。,2
Googleユーザー,2019年2月13日,4,音楽好きにはいいアプリです,1
奥本善基,2020年1月19日,5,プレミア特典は嬉しい‼️,0
五島興,2019年8月2日,5,😥😥😃😚😣😣😖😔😖😖😣😒😖😚11111111ああアアドアミラーエタカ裏側下さいってかく1😖😥😁感じ.が,0
上野山正志,2019年12月9日,5,なかなか最高なアプリです,0
tetuya shimada,2019年12月28日,5,暇潰しにちょうどいい,0
井上芳,2019年12月26日,5,いつも聞いている,0
たこわサッチャー,2019年12月28日,1,LISMOをかえして・・・,2
原辰マサ,2019年12月22日,3,楽しく聞いています。,0
Hiroyuki Komaki,2020年2月2日,2,、目七なす見ぬ歩と、,0
安藤明美,2019年12月23日,1,LISMOを返して‼(>_<),1
tokuhara tsuyoshi,2019年12月26日,5,ずっと使ってます❗️,0
きなこ,2019年11月19日,1,強制終了します,0
横山訓,2019年3月15日,2,なかなかダウンロードができません,1
佐藤かぇで,2020年1月2日,3,ふもなくかもなく｡,0
小出昭夫,2019年12月10日,4,大変便利です,0
勝神野,2019年8月20日,4,不満なく利用させて頂いてます。,0
お道,2019年12月13日,5,毎日聞いてます。,0
戸辺誠一,2020年1月10日,5,いいと思います。,0
鳩野千尋,2020年1月18日,5,サザンは青春の思い出です♥,0
AKIHITO HASEGAWA,2019年8月2日,5,音楽アプリで一番気に入った,0
古閑文秋,2019年9月29日,4,昔し聞いた懐かしい音楽。歌,0
若林勇気,2019年6月14日,1,Myうたしても、いつか消えてしまう,3
lotusplatinum,2019年12月4日,1,使えない。 LISMOに戻せ❗️,2
山口美夜子,2019年12月4日,5,とっても良いです♥,0
袖山江利香,2019年4月9日,5,いつも利用させていただいてます。,2
Googleユーザー,2018年11月12日,1,検索したやつでてこないし、正直このアプリ使わないので早くアンストしたい。,0
Googleユーザー,2019年3月18日,4,好きな歌を探しやすい,2
若杉綾馬,2019年7月29日,3,そななか差はさたはらは,0
清水悦子,2019年12月22日,1,電車🚃の中で聞いてます,0
水門裕一,2019年12月29日,5,すごくいいよ,0
早川保,2019年11月27日,5,使いやすいです。,0
太田翔太,2019年11月21日,1,ゴミ 再生されんしリスモ返せ,2
清水みか,2019年12月6日,4,いいと思う,0
サウザー,2019年4月27日,2,聞けない歌手多すぎる お金払っているのだから すぐになんとかして,1
おでん,2019年12月23日,1,勝手に流れるうざい,0
零黒舞,2020年1月16日,5,みんな自由だ,0
舘川輝昭,2019年2月8日,3,好みの曲を選曲してくれる,2
t h,2018年9月30日,1,ごみ。デフォルトでこんなの入っていても使わないしいらない。,1
小西仁,2020年3月3日,1,本当に使えない。アタマおかしいよ、このアプリ開発した人。最悪。,0
一徳小松,2020年3月28日,1,ぜろだよ。ふたとおり、みとおりかねだしたぶぶんのほしょうしろ,0
亜莉朱猫兎,2019年8月7日,1,明らかにLISMOよりレスポンスも悪いし、何かと使い難い。 何故LISMOを取り止めたのか？ auユーザーを馬鹿にしているとしか思えない。,8
たにきょうこ,2019年6月14日,4,とにかく、いいのです。リアルタイムでホットな。,1
荒川正彦,2019年7月17日,5,いろんなシーンでのチョイスが気に入りました❗,0
Googleユーザー,2019年2月14日,1,画面がよい,2
Googleユーザー,2019年3月26日,5,昔のドラマの曲が聞けるみたいでうれしいです,3
かねゆきそう,2019年7月20日,1,何でこんなアプリあんのau スマートパス有るのにデフォルトじゃん,0
アンタレス1,2019年3月3日,1,LISMOのライブラリが無いから使いづらい,9
勝俣聡嗣,2019年4月9日,2,利用する意志が無いのにしつこい❗,0
吉川知明,2019年11月27日,4,良いなりよ,0
Googleユーザー,2018年12月12日,2,ちょうど良いところで見れなくなって聞けなくなってしまったので残念です,2
Googleユーザー,2019年3月19日,1,聴きたい歌を検索して聴けないからやめようかと考えてる‼️,0
森山良男,2019年7月31日,3,操作の仕方が、良くわからない。,0
ぞんちゃん,2020年2月24日,1,使えなすぎる。LISMO使えるようにしてください,3
高橋孝幸,2019年4月9日,1,アンインストールできない,1
Googleユーザー,2019年1月4日,1,障害者には必要ないです(>_<)？プライバシーが怖いです😂,1
koichi nabatame,2019年11月4日,3,最新の曲が聞けない。,0
_27茶摘み,2019年11月7日,1,LISMOに戻してください。お願いします。,0
瀬井芽依,2019年7月11日,1,LISMOだけ使えればいいので独立させて欲しいなぁ 前はそうだったよね？戻してほしいです,3
古閑文秋,2019年8月20日,3,昔し聞いた懐かしの音楽～歌,0
日野美咲,2019年7月14日,5,自分が聞きたい曲が入っているので良いなと思いました　 私はとくに乃木坂４６の歌を入れています,2
井上繁稔,2019年11月13日,2,LISMOが無くなって不便になった。,0
菅原正彦,2019年9月23日,5,前も使っていましたが、このアプリが、使い勝手が良い‼️,0
とろさば,2018年11月5日,1,MAMAの投票が出来ません‼️最後の入力ではじかれます。早くどうにかしてください‼️,3
ヒロユキフルタ,2018年10月2日,1,何を 伝えたいのか また、言いたい事はなに 良く分からない,0
藤原勉,2020年1月5日,3,家ねーだありー,0
窪田照美,2020年1月31日,5,好きな嵐のうたがきけるのでいいです,0
霧島しま,2019年4月5日,1,LISMOに戻して お願いだからLISMOプレイヤーに戻して欲しいです。本当に使いづらい,26
hero sea,2019年8月30日,4,auなので一番使いやすいかと 他のアプリを使った事がないので‥‥,0
初音アリス,2019年3月30日,1,好きな歌聞けてうれしいです,3
i noriko,2019年6月5日,3,KーPOPをもっと増やして欲しいです,0
Over Sia H.R,2018年11月27日,1,今までリスモ機能ついてたのにアプデしたとたん消えたんだけど… 愛用してたのに… 評価だださがりです。,5
むとうたけお,2020年2月27日,1,もうムダな抵抗は止めてLISMOの復活を。,2
倉田だぽん,2019年5月7日,5,私的には。GW🎵☺️😫😫😫😫⤴️😒つまらないのて。。。誕生日藻近くて🎵嬉しいワイ😱 05111984誕生日には。ふつーに帰ってこいよー！Σ(×_×;)!貴之たまにでもいいからさぁ😃🎵☺️😫😫りんりん🐼,1
森晶,2019年5月8日,4,いいんだけど、微妙。,1
Suzu,2019年4月15日,1,昔のLISMO!の方がプレイヤーとしては使いやすかった‥…(´･ω･`),13
小林かずこ,2019年6月13日,1,邪魔！！！アンインストールさせてくれ！,0
上原護,2019年11月2日,1,意味が分からん‼️普通に音楽を聴くようにしてや‼️,1
小坂ヨウジ,2019年2月20日,5,・！！。！。！！ろ・！、ろ　！！　！　ろ、！、！,1
Googleユーザー,2019年1月31日,1,LISMOのほうが断然良かった。こんなゴミ使うぐらいなら他に渡る。ばいばい,14
佐藤真弓,2020年3月14日,5,楽しく聞いてます！,0
Googleユーザー,2019年4月19日,4,お気に入りにアーティストがないのが残念,1
Googleユーザー,2019年1月8日,5,まぁ使えるヾ(･ω･｀)ﾀﾞﾈﾀﾞﾈ♪‌‌,3
神谷基,2019年1月18日,3,良くも、悪くもない、気分転換 人は世につれ、唄につれ。,1
北崎豊,2018年11月7日,5,私の中ではこれ以上のミュージックアプリはございません❤️,1
Googleユーザー,2019年1月18日,3,中森明菜さん大好き❤️な新人です。宜しくお願いいたします⁉️,1
らいと。,2019年1月16日,1,以前のLISMOと比べると遥かに劣る改善しなくていいからLISMO復活させてください,10
明神浩二,2019年5月10日,2,あまり使ったことがないのでこれからもヨロシクお願いいたします使いかたもお願いいたします,0
平川ルミ子,2018年12月8日,1,曲ダブって入っているので❗️削除していたら強制終了して出来ない‼️,0
Googleユーザー,2018年9月14日,3,LISMOの時が今以上に使いやすかった。,9
智章三澤,2020年2月27日,4,なかなかよかったです,0
三宅利己,2019年5月8日,4,瑠奈他に(o´ｴ｀o)bかにか名地輪西、船引を、時間が、。や中柿生にぇかしこ絵か悪愛は？✴なんだヽ(´Д｀;)ノか,0
Googleユーザー,2019年1月11日,2,運営さんのリストから聞きたい曲を選択ですか？,2
徳山佳子,2019年3月16日,3,LISMOのマイリストが全部引き継げないのが残念,2
福寄むる,2018年11月19日,3,これしか分からないので使ってます。,0
わたなべ幹,2019年5月13日,2,せっかく作ったアルバムがダメになってのは悔しい‼️,1
ヨンタン2,2019年1月17日,1,アンインストール出来ないので、困った,11
浅見正幸,2018年10月11日,2,とにかく使いにくい LISMOのほうが使いやすかったです,19
Googleユーザー,2019年3月13日,4,CC R お願いします。気にいっています。,1
実況チャンネル桜バラ,2019年3月28日,5,関ジャニ∞入れて下さいお願いします🙇⤵,1
hoshino chiaki,2018年11月2日,2,MAMAの投票のためにDLしたが表示がない??,2
手嶋愛,2018年11月10日,1,MAMAの投票はうたパスだけです。 早くなおしてください。,1
内田徹,2020年2月3日,4,いいね。頑張れ🎵,1
Googleユーザー,2019年3月20日,5,あむたかまかあむたかまかたあったので、たたたおおおおおおおおおおが,1
かぁおドワモエ,2018年11月25日,3,買ったけどダウンロードの仕方がわからない,2
Googleユーザー,2018年9月26日,5,最高だゼ‼ これからもよろしくお願いします。,0
池野鴨鹿,2019年3月14日,5,音が、良いと思います。有難う‼,1
横山正,2019年1月9日,5,良く、使わせて、もらってます⁉🙆,3
松風貴子,2019年6月2日,5,気持ちを上げたい時にはこのアプリで すね‼️,2
YUKIKO TOUMA,2019年5月31日,5,ギガ数のあるときは最高です❗,1
小畠繁男,2019年5月1日,4,前からファンの歌手が居ないので星４つです,2
星を見た囚人,2018年9月12日,1,アンインストールしたのにずっと残るんですが,2
山本直樹,2019年11月4日,5,お世話になります。,0
坂本博昭,2018年12月25日,5,私は初めてですのでよく分かりませんので,0
河原柊弥,2019年4月8日,1,うgGrankrazorrtyrtしたけどししろッってわけきい※ーっっっっっっっっっっっっっっは(^.^)おteachertechnicallllkllkpklllllllloいっっっっっっっっk※lpーlR,1
Googleユーザー,2019年2月28日,1,最低。知らない間に金取られてた,0
豊山雄司,2019年3月13日,3,楽しんでます！,0
Szみな,2020年4月13日,1,LISMOに戻してくれ,1
佐々木正一,2019年6月11日,1,使いにくくなった！,2
関口剛史,2019年4月5日,1,まったく使えない、使いづらい。はやくLISMOに戻せ,16
Googleユーザー,2018年10月27日,5,楽しく使っています。,4
濱田紀子,2018年12月17日,5,家事をしながらたのしんでいます。,4
森吉隆,2020年2月12日,1,ダウンロードすらできない‼️😱,1
Googleユーザー,2019年3月13日,2,買い方が、分かりません。,3
秋元恒雄,2019年9月27日,2,月に10曲では、話しにならない,0
金Tete & YonTan & Non Tan,2019年4月10日,1,使い方が、全然分からないです。,1
Mark Syu,2018年10月25日,1,いらない、アンインストールしたい,3
木坂昌司,2019年4月5日,5,ツーリングに良く聞いて✨😆👂います。,3
masako y,2018年10月23日,2,前のLISMOの方が良かったです。,1
若本昌平,2019年4月18日,5,磐梯山(￣▽￣田沼;)と、何で、優しくかた,1
青田塁,2018年11月21日,5,いろんな曲が聞けていいです,1
Googleユーザー,2019年3月20日,1,反応しない。どうなってるんだ❗️,1
荒井百合子,2019年8月4日,5,楽しいドライブできてます(*^^)v,0
Googleユーザー,2018年10月11日,5,本田美奈子さんのマリリンが聴けて😭😭🎵,4
tough ZZZ,2019年1月6日,1,フルで聞けなくなった！,1
中村理子,2019年5月7日,3,まあまあ使いやすいです。,1
やまさと,2018年10月1日,1,重くなるからいらない。,1
LYU drums,2019年9月28日,1,ただひとこと、 LISMOのがよかった。,2
katsuhiko segawa,2020年1月13日,2,LISMOが良かった。,3
新井唯介,2018年9月14日,2,うたパス要らない、LISMOだけでいい,8
Googleユーザー,2019年2月9日,4,好きなｱｰﾃｨｽﾄばかり,2
駒宮泰春,2020年1月9日,5,ワールドビジョン2020.komamiyayasuharu,1
月上月下,2019年7月10日,1,LISMOだけで十分なんだよなぁ,2
中谷忠幸,2019年12月14日,2,銀座の恋の物語石原裕次郎,0
河野睦美,2018年11月4日,2,mamaの投票が出来ません(;o;),3
今井誠,2020年2月23日,5,最高😃⤴️⤴️アプリだけどねぇ😃,0
Googleユーザー,2018年12月3日,5,大変気にいってます。,0
孝徳浦野,2019年4月15日,1,リスモのままで良かった 嫌いです,0
大國幸治,2019年6月16日,3,初めて見たのでまだよくわかりません,1
98 R,2019年9月29日,1,ユーザー目線ではないアプリ,0
三浦茂丸,2020年2月22日,5,良かったです。,0
太郎鴉,2019年3月12日,1,使い勝手悪い😥,3
原昂平,2019年8月10日,2,サウジアラビア駅あ会う、らうすあ禹さまうまかううたおあたまか,0
Googleユーザー,2018年12月26日,5,いい感じ(*^ーﾟ)b ｸｯﾞ,1
Googleユーザー,2019年3月13日,3,少し使い辛い。,2
猫・なっつ,2019年4月26日,3,LISMOのウェジェットなくなった…,4
大橋正貴,2019年6月1日,4,刺さすな参加です疎すさすさすは３ヶ月？❗すささしす,1
築城純子,2020年4月13日,5,幸せになろうよ,0
椛†竜菜琴啓,2018年10月28日,1,いらない　なぜアンインストールできない‼,1
奥山誠治,2019年11月25日,4,大変よいとおもいます_,0
Googleユーザー,2019年3月19日,3,今、使い始めました,2
横田誠,2019年6月23日,5,いあんだよね、１１１１１１１１１１枚後も,1
Googleユーザー,2018年12月14日,5,そこそこ使えます。,1
伊藤彰紀,2019年10月24日,5,田味わい。433 時間とに,0
Googleユーザー,2019年3月26日,1,歌手の名前て選ぶ方が分かりやすい,1
Googleユーザー,2018年12月5日,4,使いかた分からない？,1
桐畑英紀,2019年7月9日,4,月作成しました、７かかき笠なさかなし,0
浅野千恵子,2019年10月9日,5,心が、和みます。,0
彦星くん織姫ちゃん,2019年3月17日,5,とても聞きやすくて大好きです‼️,0
Googleユーザー,2019年1月7日,1,普通にLISMOのプレイヤーだけ使いたい,7
Googleユーザー,2019年3月11日,2,好きな音楽しかきかない,9
双子座カノン,2019年3月27日,1,なんかLISMOの方が良かった,1
中西将大,2018年10月13日,5,たまに強制終了する❗,8
中尾洋一,2019年3月13日,1,仕方なく使ってます,8
隆稔安井,2019年3月24日,5,いいよいいよいいよぉー,0
Akiko SUZUKI,2019年3月13日,4,いつも活用してます,2
三浦正行,2019年7月8日,1,またよろしくお願いいたします。🙇,0
今井千絵,2019年10月21日,3,まぁまぁかな⤵️⤵️,0
鈴木道恵,2020年1月28日,1,無量じゃあ無いしぃ☀,0
ぽっぱぁ,2019年8月9日,1,LISMOプレーヤーを返して…,2
Googleユーザー,2019年3月20日,3,使いやすいと思います。,0
Googleユーザー,2019年3月14日,5,大変重宝させてもらってます。,0
Antonio Tonio,2019年3月13日,5,物凄く良いのかなぁ？,0
水野貴志子,2019年5月14日,5,聴きたかった～ 🎵,1
海野紀美子,2019年6月25日,2,どうしたらいいのかわからない,0
西井ちずみ,2019年7月26日,5,いいね☺SD聞けるって(^^♪,0
正廣大平,2019年3月19日,4,仲間がいいといてます,0
ササキヒデアキ,2019年4月4日,3,たまに利用します,0
佐藤太郎,2019年11月2日,1,LISMOに戻して,0
小倉祐二,2019年5月8日,1,昔のLISMOの方が使いやすい,5
成合貴代,2019年12月27日,4,楽しんでます。,0
森岡孝次,2019年5月22日,5,大変助かってます。,0
Googleユーザー,2018年10月16日,4,なかなかいいよ,0
あゆゆみぃる,2019年2月23日,1,LISMOがない どこにあるんだ,10
高田忠幸,2019年4月30日,3,いまいち、使いにくい,1
井上満子,2019年11月19日,1,邪魔ですね,0
平尾昌三,2019年3月11日,2,あまりよくわからない,2
岡田さおり,2019年4月15日,1,前よりつかいにくくなったから,2
水野清和,2019年4月2日,5,いろんな音楽が聞ける,2
稲穂誠樹,2019年1月22日,5,満足できてます🎵,2
由美清水,2019年3月31日,5,競馬のサウンドやっぱり私は,0
Googleユーザー,2018年11月1日,4,良いアプリですね,0
山西昭夫,2019年4月5日,5,差は府ひひほさあ❗か画像たなねたさに空挺阿多ぬたくくし画像はなたかさぬご飯シの波ナク苦手科奈根な,1
福留彰騎,2019年5月29日,4,いい歌があった,0
菅沼博実,2019年4月16日,4,いい感じでした,0
ろーりゅー,2018年10月9日,1,アンインストール出来ない,1
高原環,2019年3月15日,3,いい感じです♪,0
こばやしてつじ,2019年5月7日,2,．ｉｍｄナナア、ローストビーフ です 33333,0
筒井直久,2019年7月22日,2,山家ﾀﾐﾁｻﾔです矢方やゆﾔﾕ田火はしはやはたまやたゆゆらゆみ他魔らよららたはたらやれやらい波はらま,0
とんぼ,2019年8月31日,1,LISMOの方が使いやすい,3
宮崎真徳,2019年9月27日,5,はぬ。 ひやなこやなかののな,0
Googleユーザー,2019年3月20日,5,音楽 好きです,0
Googleユーザー,2018年11月11日,5,なくてはならないもの,0
江頭真規子,2019年4月10日,4,友達と共有します。,1
上野由紀子,2019年6月10日,5,最高やで、,1
ナオミチ6110,2019年10月11日,2,削除が出来ない,2
Osamu Nakamura,2019年6月28日,2,検索がしにくい,0
Mr hiroteey,2019年8月11日,3,なかなかいいよ,0
soma mitsuyuki,2019年2月21日,2,またに変な分になる。,2
Googleユーザー,2019年3月14日,5,これに決めてます。,0
ヤソダマサユキ,2019年9月24日,4,とてもいいです,0
Googleユーザー,2018年11月1日,5,気軽に聞けて良い🎵,2
Googleユーザー,2018年11月20日,5,良いと思います‼️,0
keita muvluv,2019年8月7日,1,LISMOの方が使いやすい,1
山尾妙子,2019年3月15日,5,津軽快挙冬景色,1
Googleユーザー,2018年10月19日,1,勝手に終了する。,1
佐藤ゆま,2019年4月15日,4,まあ、良いですね,1
アカウント,2019年7月31日,1,なんでLISMOないの？,1
久保田瑞弥,2019年3月14日,3,とても良かった,0
津川 公明,2019年4月23日,4,結婚式っmくkっmnーkーkんっっっみっkっmんにんっmはKんmんkmkm７いんっmjっっmんっlんっmんっm,1
Googleユーザー,2019年7月4日,4,昔し聞いた懐かしの歌音楽,1
Googleユーザー,2019年3月30日,4,良いと思います。,0
Googleユーザー,2019年1月29日,4,よかったです,0
城谷泰生,2019年6月10日,1,LISMO変えた方がいい,5
小野満司,2019年4月13日,5,探しやすいです,1
なひとこなつ,2019年1月21日,5,使いやすくていい,3
Googleユーザー,2019年3月28日,5,楽しんでいます‼️,0
藤原Googleのアプリサイトを利用する料金を支払う時にプリペイドカードを使わせて下さい,2019年3月28日,4,最高ですよ😄,0
桜木花恋,2019年4月27日,4,安くていい,1
伊豆丸善之,2019年5月4日,4,良いと思う,0
斎門徹,2019年4月5日,5,重宝してます,0
丸林貴行,2019年3月20日,5,いろいろ曲良かった,0
Михаил Михайлович,2018年10月3日,1,ｺﾞﾐｸｽﾞ過ぎる 非常に邪魔 要らない,1
行徳真理,2019年3月23日,5,よかったよ,0
柴垣由美,2019年7月6日,5,いつ聞いても懐かしい,0
山崎華子,2019年8月23日,1,いらないのに消えない,1
よ,2019年9月23日,1,開けないんですけど,1
Googleユーザー,2019年2月22日,1,大したことない,3
上間麻衣子,2019年4月23日,4,さく←」←」←」」」」」←^＼^＼＼＼,1
アキヤママサトシ,2019年3月1日,4,すっげ〜サウンドパッね〜🎶🎶,1
shilaw,2018年10月14日,5,邦楽が豊富で最高👍,2
小林真佐美,2019年5月19日,5,いいと思う,1
Googleユーザー,2019年3月29日,5,役にたちました,1
コベンハナコ,2018年12月5日,5,難しくなく、選びやすい,0
田村梨恵,2019年5月30日,2,強制終了がおおい,1
Googleユーザー,2018年10月6日,4,良いと思う。,0
katsuyoshi nishikura,2019年8月20日,1,前よりダメだね,1
匿名希望,2019年11月26日,1,使っていない,2
佐藤栄司,2019年1月26日,1,通知がじゃま。,0
Googleユーザー,2018年10月9日,4,よくわからない,1
rouge feminine,2018年11月1日,3,まだ良く理解していない,2
むらはたひらみつ,2019年9月25日,5,最高でしたよ‼,0
PADI PADI,2019年3月13日,3,よくわからない,1
