name,date,rating,content,like
ぬまぷ,2020年1月22日,2,ジャケットが表示されない Google Pray Musicではちゃんと表示されてるしパソコンで確認してもジャケットもダウンロードされてるのにうたパスでは表示されない,0
松澤明奈,2020年1月9日,4,好きな曲がかかった時、歌詞を見ながら聞けるし、聞きながら移動や作業もできる。,17
森岡友治,2020年2月9日,5,いつも、長距離運転時に、聴いています。,1
Horiuchi Yusuke,2020年4月4日,3,使いにくい。探しにくい。,0
yuyach,2019年12月11日,1,保存した楽曲が全部消えます！ アカウント作り直して2回目なのにまた消えた！ 利用料金泥棒するな！！！,5
Na2 K,2019年12月30日,5,色んな曲が聴ける。好きな曲だけじゃなくランダム再生されるから、新しいメロディと出会える！,18
堀崎真一,2019年12月22日,5,歌詞が表示されるだけではなく、カラオケのように曲に会わせて歌詞の文字色が変わります。,3
suguru mori,2020年1月5日,2,バックグラウンドでなかなか再生されない、、、 鼻くそレベルですね、イライラする。,2
池島喜美子,2019年12月24日,5,ウォキングで聴いてます ラジオもいいけど、曲を選べるのとその日の気分で曲を選べるので 最高です,7
佐々正子,2020年2月13日,5,子どもが好きな歌が聞けて嬉しい,2
ヤマダタロウ,2020年3月22日,4,いつもお世話になっております。,1
牛田阿沙栄,2019年12月21日,4,アプリが急に停まってしまい音楽が聞けません!早急の改善をお願いします,9
BF4ルー芝,2019年12月26日,3,普段使いは問題ないが、リストを整理する際に曲の削除ができない,5
king kisa,2020年1月9日,2,定額のうたパスが起動してライブラリの中のアルバムが音声入力ですぐに再生出来ない,0
神サッカー,2020年1月13日,4,大変良いと思います。使い方が、もっと分かれば、スムーズかな。,0
木谷都,2020年1月19日,1,解れば早くコメントしてますよ。今、聴きたい曲有り（ 山崎カヨ 織江の唄）とテナ－サックス色々。以上。,1
Takayuki Ikegami,2020年2月8日,1,Alicia KeysのGirl On Fire 2017-11-20の歌詞を削除して欲しい 曲のテンポと歌詞が全く合っていない その他の楽曲でも歌詞が出ないなんてあり得ない さらに歌詞をリクエストしても全く対応無し,0
つぼみの紫陽花,2019年12月10日,1,ダウンロードした曲が急に削除される 再ダウンロードにもデータ通信使うし、もう二度とこのアプリは使わない,5
山田春香,2020年3月22日,4,色々聞けるようになって良いです！,1
笠井光博,2019年11月22日,4,曲目に依って、歌詞が出ない事がございますからですね‼。,4
hide yama,2020年1月12日,1,この度、解約します。スマートパスプレミアムと併せて金額が高額です。,2
後藤滋,2020年1月9日,5,幅広いジャンルの曲が手軽に聴けてBGMとして最高です。,3
なかじゆき,2019年12月29日,5,家でならWiFiでパケット料もかからないので、歌パス！！大満足できかせて頂いてます!,2
山村三也,2020年1月12日,3,機種変更をする前は音飛びが結構あったけど、今は無くなった。,0
Duffy Mickey,2019年11月19日,5,スマートパスプレミアムで、追加料金なしでこんなに沢山の楽曲が楽しめるなんて、auさん最高です🎵,7
kazu_ k3,2020年1月17日,2,Topページが分かりにくい。シンプル is ベスト。 歌詞機能は最良。,1
古谷三紀,2020年3月13日,3,１０曲では、少なすぎです。,0
トイ,2019年12月31日,2,聴いてると強制終了される 早期解決求む 自分の使ってる機種はXperiaXZ1,0
モリンバチャンネル,2019年12月15日,3,うたパスと購入するアプリが違って 私には分かりにくいし、ちょっと使いづらい。,2
石神淑子,2020年2月6日,4,音質が良いです,0
ろい,2020年2月24日,2,定期的にmyうたが再ダウンロードになるの何とかなりません？めんどくさい。,1
Nao-T-Phantomhive,2020年1月5日,3,しょっちゅう保存した曲が再ダウンロードしなければならない。 おかげで、ギガの消費が半端ないので、どうにかして欲しい,1
本間和彦,2020年1月5日,1,聞きたい曲を探せないアプリほどつまらないものはない！,3
Miki,2020年2月12日,1,機種変したらLISMO消えちゃってて不便 音質も悪いし使い勝手悪すぎ 戻してほしい！,0
千代美小島,2020年3月21日,5,最新曲が出たら検索してダウンロードしています,1
あかはにゃんこの家,2019年12月4日,1,購入済みの楽曲をダウンロードしようとすると、アプリは応答していませんと出て来てダウンロード出来ない。,3
渡邊幸子,2020年1月3日,5,好きなアーチストの楽曲が聴けるので、気に入っています。,3
森田トモヒロ,2020年1月10日,5,最新曲に懐メロ更に洋楽にサントラもスマホでヘッドホンステレオ感覚で聴ける,1
前澤留男,2020年4月2日,3,もっと単純で良いのかなぁとも思う。,0
田中寛之,2019年12月28日,1,更新できない。曲買ったのに無駄になった。ずーーーーーーーっとダウンロード待機していつまで待機すんの？,0
政次宮越,2019年12月13日,2,一月に10曲しか保存できない、しかも間違えても消去できないのが残念,4
有田紀美世,2020年3月12日,4,懐かしい曲もあるので嬉しいです🎵,1
Yoshinaga KIRIMOTO,2020年2月21日,4,使い易く、気に入ってます。,0
いおりんご,2020年1月29日,5,最高のアプリ🎵 ただアーティスト名で、検索できればもっといいかな🎵,1
瀬谷彰規,2019年11月29日,1,必要無いのにラジオ番組の拝聴をさせられた気がします,5
アオキミノル,2019年11月21日,4,佳子やら　MT儺非に墓碑ラﾔﾆﾉなりぬなやこしこちらこそ、此の湯なら泣かぬ久手朝日は名貫な。すですよ。、楚歌獅子巣寿古咲かし個弐そりふるはるすかたてか,1
高梨恵子,2019年11月30日,4,アルバム曲を聞くのに使い方がちょっと複雑,5
Koji Kobayashi,2019年11月23日,1,スマパスプレミアムなのに他の無料プレーヤーと同じ、利用価値は低いなー,9
Algas Palude,2019年11月25日,1,バッググラウンド再生が出来ない･･･,6
恵青木,2019年12月15日,2,スマプレで聞けるようになって嬉しかったけどシャッフル再生でしか聞けないので知らないのが続くのが…,1
マスダフミオ,2020年1月28日,1,最低のソフトです。星の数はマイナス5を、付けたい！,1
谷本志保,2019年11月17日,5,嵐も解禁され、好きな曲をマイナンバーに登録して楽しい時間を過ごしています,3
西久子,2019年11月25日,5,好きな音楽がたくさん聴く事が出来て嬉しいです。,3
ジングル鈴木,2020年4月3日,1,You Tubeでいいってなる,0
yuzuri ***,2019年12月10日,1,バックグラウンド再生ができなくなる。,2
二神真由美,2020年1月12日,4,ジャンル解りやすく、とても便利です,2
鈴木かおる,2020年4月12日,2,使い勝手が良くない。,2
宮武克美,2020年3月9日,2,イコライザー機能が無いので残念です。,0
田村美恵,2020年3月4日,5,毎日好きな歌を楽しんでいます(*^-^*),1
竹内綾那,2020年3月24日,5,いろんな歌が聞けていいです🍀とても気に入ってます☺️,2
土橋勝彦,2019年12月27日,4,再生順に登録日があるともっと良い。,1
goma min,2020年1月29日,3,旧LISMOの方が個人的に使い易いと感じています。,1
アンドーマサキ,2020年4月3日,1,LISMOだけで十分。 音楽プレーヤー付きではなく、音楽プレイヤーのみのアプリを開発してください。昔はあったでしょ？ 広告機能付き音楽を有料で見ているだけでしょ。 音楽プレイヤーのシステムが最優先で表示されることを望む。 これは15年くらい前の携帯には当たり前に備わっていた機能です。 15年前の方が性能も反応もものすごく良かったですよ。,1
藤田隆一,2020年1月30日,5,懐かしい曲が結構あるので嬉しい。,1
嶋田希美,2020年2月10日,3,少し扱いにくい。,1
黒澤,2020年3月30日,1,楽曲がちゃんと表示されない事を問い合わせても返信メールであれこれを試してそれでも改善されなければ楽曲名を明記の上再度問い合わせしろと言う。…んな事もうやってるんだよ。楽曲名を明記して再度問い合わせないのは表示されないのが多すぎるからってことに気付けよ。 直でKDDIにクレーム入れた方が早そうだ。 最低アプリだから使っちゃダメだだよこれは。,93
入江秀雄,2020年1月6日,1,曲順が、自由に、ならない。,1
TORANORI PAPA,2020年3月5日,1,開く事すら出来ないゴミアプリ,0
こめつぶ,2019年12月27日,1,イヤホンじゃないとバッググラウンド再生出来ない、最悪なアプリ。,0
綾柳田,2020年2月23日,4,色んな音楽が聞けて楽しい,1
まーしん,2020年2月28日,5,歌好きなら、聞きゃあいいはなしやん,1
松山勇斗,2020年2月4日,1,再生できないってなる,0
藤原稲子,2020年1月17日,5,ちょっとむずかしいけど楽しい機能です。,3
澪,2020年1月27日,1,ログインが出来ない。,0
Racer56 HY,2020年4月10日,5,カテゴリー別のリストがいいと思う,0
美香丹野,2020年2月1日,1,auスマートパスプレミアム会員特典で聴き放題になったとの事でダウンロード。 いくら物価高になったとは言え、便乗したかのようにプレミアム会員への対応が悪すぎ。このうたパスも同様。 「プレミアム感０」,1
野田和敏,2019年11月23日,5,沢山の曲があり、満足です。,3
大久保真樹,2020年1月15日,1,全く何も聴く事が出来ませんでした。,1
kazuyo s,2020年1月17日,4,新曲や昔好きだった曲が 直ぐに見つかるので 嬉しいです,1
満井美子,2020年1月4日,4,少しだけ、毎日が楽しくなります。,0
アムロkeiji,2020年3月29日,1,ミュージックストアで購入した曲が全て消えた！SDカードに保存しておいたからまだ良かったがミュージックストアもうたパスも信用出来ない！これからは他で購入する予定です！,0
Layla LAYLA,2019年11月1日,1,,58
難波美由紀,2020年3月25日,4,新しい曲やアーチストの曲等聞き放題なので色々聞けて新しい発見もあってすごく良いです。買う時の目安にもなります。,0
高橋眞澄,2020年1月16日,4,好きな曲をいつでも聞けて良いですね！,1
駒形有紗,2020年4月7日,1,ローカル保存されていた曲が定期的に消えます。そのたびにうたパスでまたダウンロードし直したり手間です。,1
Chisato T,2020年4月12日,1,ダウンロードした曲再生したら一部バグってるし、曲の削除もできない(削除するとアプリがフリーズする),1
Ma Fu,2019年12月13日,1,music storeで購入した曲をDLする為だけに入れたのですぐにアンインスト、こんな使いにくいアプリない。アプリとしてはLISMOの時の方が良かった。 またスマパスプレミアム会員ですが、サービス内容も良くない。 聞きたい曲をすぐ聞く事が出来ない。 このサービス内容ならアマゾンプライム会員のamazon musicの方が優秀なのでそちらを使ってます。,2
野本章宏,2019年11月12日,1,,34
太田要,2019年10月25日,2,ＬＩＳＭＯが非対応になったので使う事になりました。が、他の方の言う通り使いづらいです。ホーム画面で曲を『止める』事はできても『再生』ができません。一々アプリのホームに戻らないと再生できません。使いづらくなり残念です。ＬＩＳＭＯ対応に戻してください。,73
まつもとこうしん,2020年3月14日,3,キャベンデイｯシュミュージックのCDを出して欲しい。,0
Wisteria,2019年10月30日,1,LISMOのみ使っています。LISMOは★5です。 うたパスは全く使っていません。 うたパスは全てがストリーミング再生に見えて不安なためです。（自身の勉強不足かとは思いますが） 「時代はダウンロードからストリーミングへ」といたるところでお聞きしますが、データ使い放題でないと難しいですし、 ダウンロードだと思っていたら、ストリーミングだった…というのは自己責任になるので、なるべく「危うきに近寄らず」したいですし…。 今はLISMOが、安心ですね。サービス内容も大満足です。 「追記」LISMO終了で、阿鼻叫喚…。これからも、LISMOを配信してほしい。,53
toi moko,2019年11月27日,1,au は、ユーザーの意見を聞いてるのか、疑問に思う。LISMOより、使いにくくなっている。聞き放題は、外出中では、あまり使えないと思う。あっという間に容量がなくなり、速度制限になりそう。もともと、LISMOは、ガラケーからお世話になっていました。統合されてからは、読み込みに時間が、かかります。改善される見込みかがない場合他を探します。,180
雪乃,2019年12月12日,1,バックグラウンドにすると落ちるのなんとかしてください,2
C K,2019年10月27日,1,使いにくいです 撮影した動画などもプレイヤーに反映されて ごちゃごちゃします LISMOの頃は非表示やリストからの削除などの機能で整理できましたが、このプレイヤーではそれができません。 再生履歴など不必要な機能です LISMOに戻して欲しいです,17
One High Bridge,2019年11月3日,1,ストアで楽曲購入してダウンロードする為にログインしようしたけどまったくログイン出来ず。折角購入した曲も聞けずじまいで踏んだり蹴ったり。そもそもうたパスに何でわざわざログインしないと購入楽曲ダウンロード出来なくしたのか分け分からん。うたパス何て使ってねーのに‥‥。支払った楽曲代返せ！そしてLISMOに戻せよ！,14
海風,2019年12月9日,4,スマートパスプレミアム加入でこれだけ楽しめれば十分ですね,1
にゅーいオレンジ,2019年11月9日,1,LISMOのときは五十音やアルファベット順でちゃんと並んでたのに、うたパスにしたらバラバラになりました。とても困ります。また、動画を再生する際にステータスバーとナビゲーションバーが消えないのが邪魔です。改善よろしくお願いいたします。,1
大久保義之,2020年1月21日,3,直ぐに聴けて便利な点がいい,0
村上寿一,2020年3月20日,1,プレゼントが無くなった。,0
ulove minmin,2020年2月17日,4,歌詞が見えて嬉しい,0
黄梅kobai,2020年3月27日,1,いらないのにスマホで音楽を聞くときに他に選択肢がない。どうすればこれを使わずに音楽が聞けるのかスマホ勉強中です。au独自のアプリは概ね使いにくい。,0
Kazuo Shimamura,2019年11月3日,4,1970年代のポップスを中心に聴いています。ほとんどの曲がカバーされているので、とっても懐かしく、若かかりし頃の自分と曲がラップし、この時代に生きている自分が尊く感じます。,27
松井敏明,2020年1月22日,2,気に入った曲だけが聞きたいので不要です。それよりも以前のようにプレイヤーで続きの曲を聞けるようにしてほしい,1
種市和歌子,2020年1月17日,5,私はこのアプリがとても大好きです。ランダムに曲が流れるところが最高ですね🎵これからもたくさんのアーティストと出会わせさせて下さい。応援してまーす❗,1
羽音,2019年11月5日,1,問い合わせフォーム探しにくい。Google store内のメーラーから送信するとエラーメール戻ってくる。新規登録勧誘通知多くてウザい。アプリ内の問い合わせフォームからは送信出来ない。なんだこれ？,6
me to,2019年11月16日,1,今の曲が優先的にして、80年代の曲が適当過ぎる。あり得ない。ただ80年代ヒットしたアルバム、曲を飾れば良いってもんじゃない。音楽馬鹿にし過ぎ。このアプリ意味がない。持ってる,1
梅元星弥,2020年2月16日,1,カーナビにHDMIでミュージックビデオながせなくなった 画面録画してないのに 「録画中の為再生出来ません」とでて再生出来ない,0
坂本ゆか,2019年11月7日,1,何かログインが出来なくなった。 前は出来たのに… 「不明なエラーが発生しました。しばらくしてからもう一度試してください」って出る どうにかして！！！！,4
Maki Nishi,2018年11月17日,2,機種変したらLISMOが変わってしまっていましたが、使いづらい。アプリが悪いのかはわかりませんが、入れた曲の名前が文字化けみたいになっていたり、うまく入ってなかったり。バックアップしたプレイリストもちゃんと復元できないのは私が悪いのでしょうか。一応前のLISMOにも出来ますが二度手間。せめてショートカットでもなんでも作らせてください。,5
Googleユーザー,2018年10月8日,2,プレイヤーの事ですが、最低限、ギャップレス再生や、アルバムの表示したい種類の指定は出来るようにして欲しいです。歌詞が出せる事以外は、必要最低限の機能しかないのが残念…というか、LISMOを知っているだけに憤りさえ感じます。プレイヤーが優秀だと利用者も増えると思いますけどね。,6
竜のしっぽ,2019年11月4日,2,レコチョクもこれもログインできない。使わせる気ある！？ログインできないくせに毎日通知が来る。かなりウザイ。仕組みがややこしくなってメチャクチャ使いづらいから、LISMOに戻して欲しい。,7
D moka,2019年11月25日,1,気づいたら過去の楽曲が聴けなくなってた。スマホは変わってないから、なんでなのか…。むしろ過去入れた楽曲聴けない方が嫌なんですが。安定しないの本当に困る。本当は星一つもつけたくない。,1
鳥神,2020年1月30日,1,プレミアム会員だから使ってみたけど、思った以上に使えない。シャッフル再生しかできんし、スキップ回数も5回まで...サヨウナラ...,2
髭本鎮,2019年3月25日,4,,14
吉野由美子,2019年11月2日,4,自分の好きな曲をマイ歌保存でいつでも聴けるので嬉しいです。検索で、聴きたい曲が検索して見つけやすいので懐かしいと当時を振り返ってます(^-^),5
吉田光範,2019年12月14日,5,曲が多く再生しやすい❗,2
山田直実,2019年9月10日,2,,25
裏腹ゴリラ,2019年11月6日,2,前までBluetoothに接続すると自動再生してくれたのにしなくなったアプリだけ起動して腹立つ 音楽も途中で止まって再生おしても(再生出来ません)はよ改善しろよ,5
北尾康太,2019年6月2日,1,取り放題の曲数と種類に関しては、まあこの程度かと納得。操作性に関してはイマイチ。プレイリストが簡単にできるところは評価しても良いけど、通信が途切れたりすると、いちいちログインしなきゃなんないし、勝手に取り放題の曲がなくなっていたりする…。この辺をもう少しなんとかして欲しい。 そう言えば、取り放題の曲はまだしも、ダウンロードした曲が一切聴けなくなるのは勘弁して欲しい。いちいち以前のバージョンで検索しないと聴けねえのか？このクソアプリが。,15
島尻順子,2019年2月2日,5,レコチョク取ってましたが、失くなってしまったため、アンインストールしてました。久しぶりに開いたら、うたパスがあり、最初の30日は無料とあったので、迷いましたが、物は試しと思って登録｡何曲か取りましたが聞き取りやすいです。,4
閼伽井さん,2019年6月10日,3,プレイヤーとしての役割を果たしてるのかどうか。 曲を再生させながらアプリを閉じると、毎回曲が止まり聴けない。(画面を消しても同様) もう慣れましたが、ストレスが溜まってる時とかに使用するとスマホをぶん投げたくなりますね。 バージョンが古い可能性もあったので、少ないスマホの容量を割いて更新しても同様。 他の方も言っている通り、外見なんてどうでもいいので機能を改善してくれ,18
S S,2019年2月8日,1,プレイリストのUXがLISMOより悪いので改善していただきたいです。 プレイリストの曲数が900近いと曲を選ぶ度に10〜30秒程度切り替わりに時間がかかります。 後、プレイリストが最初10曲だけ表示していて「すべて見る」をいちいち選択しないといけないのがかなり無駄な操作に思います。 普通、すべて見ます。 毎日使っているアプリですので、何卒ご検討のほどよろしくお願いします。,19
yas o,2020年3月13日,1,フリーズしまくり、新規ダウンロードしたものは聞けない。話になりません。,0
押川清香,2018年11月12日,2,LISMOと統合されたので仕方なく使っていますが、本当に使いづらい！ 楽曲購入画面とプレーヤーが同居してて画面が見にくいし、ウィジェットの操作性も悪い。なぜLISMOプレーヤーと同じように作らなかったのかと。 この仕様でOKを出した人は音楽をスマホで聞かない人だと思います。 LISMOプレーヤーと同じように使えると思っていると、心の底からがっかりするアプリです。,16
BABA QUALITY,2018年11月17日,2,au使ってて音楽はダウンロードしたらこのアプリにいくから仕方なく使ってる。使い勝手は凄く悪い。楽曲は何故か同じのが二三曲入る場合もあるし、削除は一曲一曲ずつしか出来ない。削除ボタンも上下移動のカーソルと近いから間違って上に移動したりして非常に使いづらくストレスがたまります。,11
匿名希望,2019年6月5日,1,歌詞表示する時横画面表示ができない。 旧バージョンのLISMOプレイヤーでは横画面表示にする設定があったので問題なかった。 しかし、本バージョンだと旧プレイヤーに変更する設定そのものが無くなっていて横画面での歌詞表示が一切できない。 この点を直してほしい。 旧プレイヤーのデザインは他のどの音楽プレイヤーより好きなのでがんばってほしい。,11
Kazunari Nakabayashi,2019年10月1日,1,,49
島本和夫,2020年4月8日,5,最初は、何にもわからず10曲をダウンロードして後で削除しても次に曲をダウンロードしたくても出来ないのが悔しい😭,0
勝利竹山,2019年8月26日,3,歌詞の色は変化しているが、曲とあっていないので、カラオケを覚える為の参考にはならないので、きちんと曲に合わせてくれ。ただ、色が変わるだけで無意味。シンガーが歌う歌詞と字幕の歌詞が違う場合がある。水の星愛を込めてのコムアイversionで歌詞を出した際に作詞が確か、秋元康で作曲が矢沢永吉になってたんだが？どうなってんだ！,9
I.なおこ,2019年9月20日,1,"新機種に替えたら、Music Playerからうたパスに移行すると表示されたので　今まで通りMusic Playerの様に使おうとしたら、LISMOで買った曲やプレイリストが表示されない。 ｢表示されない場合はココ｣と書いてある""ココ""がタップできない。 ｢聴き放題に加入｣ばかりタップさせようとしてる。 LISMOやMusic Playerの方が全然良かった。",38
瀬名新太,2018年11月30日,1,相変わらず変わらず…再生を止めると｢再生出来ません｣と表示、再び開くとビデオのプレイリストは消え再生出来ず(怒)以前のライブラリが見つからない場合はこちらを開いたり閉じたりして全曲を表示させて再びプレイリストに追加しての繰り返し(怒)こんな不便なアプリない,20
